21;Buthraupis;montana;Hooded Mountain Tanager;cucullata;Bob Planqué;Ecuador;La Libertad, Cañar;-2.6;-78.7;song;hooded_mtn_tan_1.mp3;http://www.xeno-canto.org/sounds/uploaded/OH38YHKJBS/hooded_mtn_tan_1.mp3;http://www.xeno-canto.org/sounds/uploaded/OH38YHKJBS/ffts/tb/hooded_mtn_tan_1.png
22;Buthraupis;montana;Hooded Mountain Tanager;cucullata;Bob Planqué;Ecuador;La Libertad, Cañar;-2.6;-78.7;calls;hooded_mtn_tan_2.mp3;http://www.xeno-canto.org/sounds/uploaded/OH38YHKJBS/hooded_mtn_tan_2.mp3;http://www.xeno-canto.org/sounds/uploaded/OH38YHKJBS/ffts/tb/hooded_mtn_tan_2.png
1993;Buthraupis;montana;Hooded Mountain Tanager;montana;Sjoerd Mayer;Bolivia;Río Milluni low camp, near Titi Amaya. Inquisivi, La Paz;-16.9001;-67.2001;Calls;35/a17a.mp3;http://www.xeno-canto.org/sounds/uploaded/KOIEAHGHNX/35/a17a.mp3;http://www.xeno-canto.org/sounds/uploaded/KOIEAHGHNX/ffts/tb/35_a17a.png
2002;Buthraupis;montana;Hooded Mountain Tanager;montana;Sjoerd Mayer;Bolivia;Río Milluni low camp, near Titi Amaya. Inquisivi, La Paz;-16.9001;-67.2001;Calls;35/b15.mp3;http://www.xeno-canto.org/sounds/uploaded/KOIEAHGHNX/35/b15.mp3;http://www.xeno-canto.org/sounds/uploaded/KOIEAHGHNX/ffts/tb/35_b15.png
10958;Buthraupis;montana;Hooded Mountain Tanager;;Charles Hesse;Peru;Abra Acjanaco, Cusco;-13.1992;-71.6178;Call;pemr03HOMTA.mp3;http://www.xeno-canto.org/sounds/uploaded/FMQSRXIRTH/pemr03HOMTA.mp3;http://www.xeno-canto.org/sounds/uploaded/FMQSRXIRTH/ffts/tb/pemr03HOMTA.png
13917;Buthraupis;montana;Hooded Mountain Tanager;;Bradley Davis;Colombia;R. N. Rio Blanco, Caldas;5.0834;-75.5001;calls;BD_2007-05-30_Buthraupis_montanaXC.mp3;http://www.xeno-canto.org/sounds/uploaded/YNXJLOESBB/BD_2007-05-30_Buthraupis_montanaXC.mp3;http://www.xeno-canto.org/sounds/uploaded/YNXJLOESBB/ffts/tb/BD_2007-05-30_Buthraupis_montanaXC.png
17542;Buthraupis;montana;Hooded Mountain Tanager;cucullata;Andrew Spencer;Ecuador;Acanama, Loja;-3.6795;-79.2376;calls;Hooded Mountain-Tanager2007-12-20calls.mp3;http://www.xeno-canto.org/sounds/uploaded/CDTGHVBGZP/Hooded Mountain-Tanager2007-12-20calls.mp3;http://www.xeno-canto.org/sounds/uploaded/CDTGHVBGZP/ffts/tb/Hooded Mountain-Tanager2007-12-20calls.png
26840;Buthraupis;montana;Hooded Mountain Tanager;;Thomas Donegan;Colombia;Filo Pamplona, Serrania de los Yariguies, Galan, Santander, 06º38’N;6.6384;-73.4089;Calls;45 Track 45 Hooded Mountain Tanager.mp3;http://www.xeno-canto.org/sounds/uploaded/OXSIOLJJUP/45 Track 45 Hooded Mountain Tanager.mp3;http://www.xeno-canto.org/sounds/uploaded/OXSIOLJJUP/ffts/tb/45 Track 45 Hooded Mountain Tanager.png
26841;Buthraupis;montana;Hooded Mountain Tanager;;Thomas Donegan;Colombia;Filo Pamplona, Serrania de los Yariguies, Galan, Santander, 06º38’N;6.6384;-73.4089;Calls;46 Track 46 Hooded Mountain Tan.mp3;http://www.xeno-canto.org/sounds/uploaded/OXSIOLJJUP/46 Track 46 Hooded Mountain Tan.mp3;http://www.xeno-canto.org/sounds/uploaded/OXSIOLJJUP/ffts/tb/46 Track 46 Hooded Mountain Tan.png
26842;Buthraupis;montana;Hooded Mountain Tanager;;Thomas Donegan;Colombia;Filo Pamplona, Serrania de los Yariguies, Galan, Santander, 06º38’N;6.6384;-73.4089;Calls;47 Track 47 Hooded Mountain Tanager.mp3;http://www.xeno-canto.org/sounds/uploaded/OXSIOLJJUP/47 Track 47 Hooded Mountain Tanager.mp3;http://www.xeno-canto.org/sounds/uploaded/OXSIOLJJUP/ffts/tb/47 Track 47 Hooded Mountain Tanager.png
27411;Buthraupis;montana;Hooded Mountain Tanager;cucullata;Niels Krabbe;Colombia;Mesenia, Risaralda;5.459478;-75.900421;dawn song;Butmon240804.mp3;http://www.xeno-canto.org/sounds/uploaded/XTVEPHMPPJ/Butmon240804.mp3;http://www.xeno-canto.org/sounds/uploaded/XTVEPHMPPJ/ffts/tb/Butmon240804.png
36114;Buthraupis;montana;Hooded Mountain Tanager;;Fabrice Schmitt;Peru;Pillahuata, Cusco;-13.1667;-71.5834;call;Hooded Mountain-tanager call, Cusco, 12nov08 FS2.mp3;http://www.xeno-canto.org/sounds/uploaded/FPAGKPAQYO/Hooded Mountain-tanager call, Cusco, 12nov08 FS2.mp3;http://www.xeno-canto.org/sounds/uploaded/FPAGKPAQYO/ffts/tb/Hooded Mountain-tanager call, Cusco, 12nov08 FS2.png
37311;Buthraupis;montana;Hooded Mountain Tanager;;Thomas Donegan;Colombia;Lepipuerto, Serrania de los Yariguies;6.4581;-73.4576;Flight call;FLIGHT CALL Hooded Mountain Tanager Lepipuerto MD4 track 9 at end of track.mp3;http://www.xeno-canto.org/sounds/uploaded/OXSIOLJJUP/FLIGHT CALL Hooded Mountain Tanager Lepipuerto MD4 track 9 at end of track.mp3;http://www.xeno-canto.org/sounds/uploaded/OXSIOLJJUP/ffts/tb/FLIGHT CALL Hooded Mountain Tanager Lepipuerto MD4 track 9 at end of track.png
37327;Buthraupis;montana;Hooded Mountain Tanager;;Thomas Donegan;Colombia;Lepipuerto, Yariguies, Santander;6.4581;-73.4576;Call;Lepipuerto MD 5 track 34 (Hooded Mountain Tan maybe) with Chlorospingus.mp3;http://www.xeno-canto.org/sounds/uploaded/OXSIOLJJUP/Lepipuerto MD 5 track 34 (Hooded Mountain Tan maybe) with Chlorospingus.mp3;http://www.xeno-canto.org/sounds/uploaded/OXSIOLJJUP/ffts/tb/Lepipuerto MD 5 track 34 (Hooded Mountain Tan maybe) with Chlorospingus.png
39708;Buthraupis;montana;Hooded Mountain Tanager;saturata;David Geale;Peru;Wayqechas, Manu Road, Cusco;-13.1745;-71.5878;Dawn song?;butmon01.mp3;http://www.xeno-canto.org/sounds/uploaded/SBFBVYGIJC/butmon01.mp3;http://www.xeno-canto.org/sounds/uploaded/SBFBVYGIJC/ffts/tb/butmon01.png
50422;Buthraupis;montana;Hooded Mountain Tanager;;Bernabe Lopez-Lanus;Ecuador;Quebrada Honda (arriba), Zamora-Chinchipe;;;Call;Buthraupis montana_Quebrada Honda (Arriba)_Zamora-Chinchipe_Ecuador_22ABR1998 a_Bernabe Lopez-Lanus.mp3;http://www.xeno-canto.org/sounds/uploaded/BYLLSJRVDZ/Buthraupis montana_Quebrada Honda (Arriba)_Zamora-Chinchipe_Ecuador_22ABR1998 a_Bernabe Lopez-Lanus.mp3;http://www.xeno-canto.org/sounds/uploaded/BYLLSJRVDZ/ffts/tb/Buthraupis montana_Quebrada Honda (Arriba)_Zamora-Chinchipe_Ecuador_22ABR1998 a_Bernabe Lopez-Lanus.png
51455;Buthraupis;montana;Hooded Mountain Tanager;;Bernabe Lopez-Lanus;Colombia;Finca Yerbabuenal (sobre Toche), canon del rio Toche, Tolima;;;Song;Buthraupis montana_Finca Yerbabuenal_Canon del Rio Toche_Toche_Tolima_Colombia_22JUN1998 a_Bernabe Lopez-Lanus.mp3;http://www.xeno-canto.org/sounds/uploaded/BYLLSJRVDZ/Buthraupis montana_Finca Yerbabuenal_Canon del Rio Toche_Toche_Tolima_Colombia_22JUN1998 a_Bernabe Lopez-Lanus.mp3;http://www.xeno-canto.org/sounds/uploaded/BYLLSJRVDZ/ffts/tb/Buthraupis montana_Finca Yerbabuenal_Canon del Rio Toche_Toche_Tolima_Colombia_22JUN1998 a_Bernabe Lopez-Lanus.png
51456;Buthraupis;montana;Hooded Mountain Tanager;;Bernabe Lopez-Lanus;Colombia;Finca Yerbabuenal (sobre Toche), canon del rio Toche, Tolima;;;Song;Buthraupis montana_Finca Yerbabuenal_Canon del Rio Toche_Toche_Tolima_Colombia_22JUN1998 b_Bernabe Lopez-Lanus.mp3;http://www.xeno-canto.org/sounds/uploaded/BYLLSJRVDZ/Buthraupis montana_Finca Yerbabuenal_Canon del Rio Toche_Toche_Tolima_Colombia_22JUN1998 b_Bernabe Lopez-Lanus.mp3;http://www.xeno-canto.org/sounds/uploaded/BYLLSJRVDZ/ffts/tb/Buthraupis montana_Finca Yerbabuenal_Canon del Rio Toche_Toche_Tolima_Colombia_22JUN1998 b_Bernabe Lopez-Lanus.png
51457;Buthraupis;montana;Hooded Mountain Tanager;;Bernabe Lopez-Lanus;Colombia;Finca Yerbabuenal (sobre Toche), canon del rio Toche, Tolima;;;Song;Buthraupis montana_Finca Yerbabuenal_Canon del Rio Toche_Toche_Tolima_Colombia_22JUN1998 c_Bernabe Lopez-Lanus.mp3;http://www.xeno-canto.org/sounds/uploaded/BYLLSJRVDZ/Buthraupis montana_Finca Yerbabuenal_Canon del Rio Toche_Toche_Tolima_Colombia_22JUN1998 c_Bernabe Lopez-Lanus.mp3;http://www.xeno-canto.org/sounds/uploaded/BYLLSJRVDZ/ffts/tb/Buthraupis montana_Finca Yerbabuenal_Canon del Rio Toche_Toche_Tolima_Colombia_22JUN1998 c_Bernabe Lopez-Lanus.png
52692;Buthraupis;montana;Hooded Mountain Tanager;;Bernabe Lopez-Lanus;Colombia;Finca Yerbabuenal (sobre Toche), canon del rio Toche, Tolima;;;Song;Buthraupis montana_Finca Yerbabuenal_Canon del Rio Toche_Toche_Tolima_Colombia_23JUN1998 13 y 48 a_Bernabe Lopez-Lanus.mp3;http://www.xeno-canto.org/sounds/uploaded/BYLLSJRVDZ/Buthraupis montana_Finca Yerbabuenal_Canon del Rio Toche_Toche_Tolima_Colombia_23JUN1998 13 y 48 a_Bernabe Lopez-Lanus.mp3;http://www.xeno-canto.org/sounds/uploaded/BYLLSJRVDZ/ffts/tb/Buthraupis montana_Finca Yerbabuenal_Canon del Rio Toche_Toche_Tolima_Colombia_23JUN1998 13 y 48 a_Bernabe Lopez-Lanus.png
52693;Buthraupis;montana;Hooded Mountain Tanager;;Bernabe Lopez-Lanus;Colombia;Finca San Jose, Quebrada La Selva (sobre Toche), Cajamarca, Tolima;;;Song;Buthraupis montana_Quebrada La Selva (Finca San Jose)_2742 m_Sobre Toche_Cajamarca_Tolima_Colombia_18AGO1998 a 7y 25_Bernabe Lopez-Lanus.mp3;http://www.xeno-canto.org/sounds/uploaded/BYLLSJRVDZ/Buthraupis montana_Quebrada La Selva (Finca San Jose)_2742 m_Sobre Toche_Cajamarca_Tolima_Colombia_18AGO1998 a 7y 25_Bernabe Lopez-Lanus.mp3;http://www.xeno-canto.org/sounds/uploaded/BYLLSJRVDZ/ffts/tb/Buthraupis montana_Quebrada La Selva (Finca San Jose)_2742 m_Sobre Toche_Cajamarca_Tolima_Colombia_18AGO1998 a 7y 25_Bernabe Lopez-Lanus.png
52694;Buthraupis;montana;Hooded Mountain Tanager;;Bernabe Lopez-Lanus;Colombia;Finca San Jose, Quebrada La Selva (sobre Toche), Cajamarca, Tolima;;;Song;Buthraupis montana_Quebrada San Jose_Arriba de Toche_Toche_Cajamarca_Tolima_Colombia_18JUL1998 14y33_Bernabe Lopez-Lanus.mp3;http://www.xeno-canto.org/sounds/uploaded/BYLLSJRVDZ/Buthraupis montana_Quebrada San Jose_Arriba de Toche_Toche_Cajamarca_Tolima_Colombia_18JUL1998 14y33_Bernabe Lopez-Lanus.mp3;http://www.xeno-canto.org/sounds/uploaded/BYLLSJRVDZ/ffts/tb/Buthraupis montana_Quebrada San Jose_Arriba de Toche_Toche_Cajamarca_Tolima_Colombia_18JUL1998 14y33_Bernabe Lopez-Lanus.png
56364;Buthraupis;montana;Hooded Mountain Tanager;;Bernabe Lopez-Lanus;Colombia;Entre La Romelia y El Planchon (PNN Munchique), Charguayaco, Vereda La Romelia, Mpio El Tambo, Cauca;;;Song;Buthraupis montana_La Romelia-El Planchon_PN Munchique_El Tambo_Cauca_Colombia_27SEP2000 a_Bernabe Lopez-Lanus.mp3;http://www.xeno-canto.org/sounds/uploaded/BYLLSJRVDZ/Buthraupis montana_La Romelia-El Planchon_PN Munchique_El Tambo_Cauca_Colombia_27SEP2000 a_Bernabe Lopez-Lanus.mp3;http://www.xeno-canto.org/sounds/uploaded/BYLLSJRVDZ/ffts/tb/Buthraupis montana_La Romelia-El Planchon_PN Munchique_El Tambo_Cauca_Colombia_27SEP2000 a_Bernabe Lopez-Lanus.png
64703;Buthraupis;montana;Hooded Mountain Tanager;;Thomas Donegan;Colombia;La Aurora, Serrania de los Yariguies, Galan, Santander, Colombia;6.6389;-73.3892;Calls;La Aurora MD7 22 Track 22 Buthraupis montana.mp3;http://www.xeno-canto.org/sounds/uploaded/OXSIOLJJUP/La Aurora MD7 22 Track 22 Buthraupis montana.mp3;http://www.xeno-canto.org/sounds/uploaded/OXSIOLJJUP/ffts/tb/La Aurora MD7 22 Track 22 Buthraupis montana.png
70324;Buthraupis;montana;Hooded Mountain Tanager;cucullata;Andrew Spencer;Ecuador;Guacamayos Ridge, Napo;-0.6237;-77.8403;song;Hooded Mountain-Tanager2011-1-15-1.mp3;http://www.xeno-canto.org/sounds/uploaded/CDTGHVBGZP/Hooded Mountain-Tanager2011-1-15-1.mp3;http://www.xeno-canto.org/sounds/uploaded/CDTGHVBGZP/ffts/tb/Hooded Mountain-Tanager2011-1-15-1.png
74794;Buthraupis;montana;Hooded Mountain Tanager;;Daniel Lane;Ecuador;SE Maldonado, Carchi;0.852;-78.029;flight song;Buthraupis.montana9707-1.mp3;http://www.xeno-canto.org/sounds/uploaded/WOEAFQRMUD/Buthraupis.montana9707-1.mp3;http://www.xeno-canto.org/sounds/uploaded/WOEAFQRMUD/ffts/tb/Buthraupis.montana9707-1.png
83732;Buthraupis;montana;Hooded Mountain Tanager;;David Geale;Peru;below Sina, Puno;;;Call;butmon02.mp3;http://www.xeno-canto.org/sounds/uploaded/SBFBVYGIJC/butmon02.mp3;http://www.xeno-canto.org/sounds/uploaded/SBFBVYGIJC/ffts/tb/butmon02.png
93163;Buthraupis;montana;Hooded Mountain Tanager;;Charlie Vogt;Ecuador;La Sofia road, Sucumbios;0.4328;-77.5789;song;Hooded Mountain-Tanager R31_0036.mp3;http://www.xeno-canto.org/sounds/uploaded/NYTXYAQSTH/Hooded Mountain-Tanager R31_0036.mp3;http://www.xeno-canto.org/sounds/uploaded/NYTXYAQSTH/ffts/tb/Hooded Mountain-Tanager R31_0036.png
93865;Buthraupis;montana;Hooded Mountain Tanager;;Oswaldo Cortes;Colombia;San Bernardo (Cundinamarca);4.2001;-74.4128;songs;buthraupis montana pandi.mp3;http://www.xeno-canto.org/sounds/uploaded/VVDRVZCVWW/buthraupis montana pandi.mp3;http://www.xeno-canto.org/sounds/uploaded/VVDRVZCVWW/ffts/tb/buthraupis montana pandi.png
