5951;Chlorospingus;flavigularis;Yellow-throated Bush Tanager;marginatus;Nick Athanas;Ecuador;Milpe, Pichincha;0.0287;-78.8628;call;012-024-Yellow-throated-Bush-Tanager.mp3;http://www.xeno-canto.org/sounds/uploaded/XRABICUARW/012-024-Yellow-throated-Bush-Tanager.mp3;http://www.xeno-canto.org/sounds/uploaded/XRABICUARW/ffts/tb/012-024-Yellow-throated-Bush-Tanager.png
8086;Chlorospingus;flavigularis;Yellow-throated Bush Tanager;marginatus;Nick Athanas;Ecuador;Milpe, Pichincha;0.0287;-78.8628;call;006-094-Yellow-throated-Bush-Tanager.mp3;http://www.xeno-canto.org/sounds/uploaded/XRABICUARW/006-094-Yellow-throated-Bush-Tanager.mp3;http://www.xeno-canto.org/sounds/uploaded/XRABICUARW/ffts/tb/006-094-Yellow-throated-Bush-Tanager.png
8364;Chlorospingus;flavigularis;Yellow-throated Bush Tanager;hiaticolus;Herman van Oosten;Peru;Tunnel near Tarapoto, San Martin;-6.397701;-76.325626;calls;ChlorospingusFlavigularis_TarTunn269061000.mp3;http://www.xeno-canto.org/sounds/uploaded/SNUDCZVUQK/ChlorospingusFlavigularis_TarTunn269061000.mp3;http://www.xeno-canto.org/sounds/uploaded/SNUDCZVUQK/ffts/tb/ChlorospingusFlavigularis_TarTunn269061000.png
9779;Chlorospingus;flavigularis;Yellow-throated Bush Tanager;;Allen T. Chartier;Ecuador;Parque Nacional Podocarpus, sector Rio Bombuscaro, Zamora-Chinchipe;-4.1139;-78.9637;Calls;Chlorospingus_flavigularis_EC-PNP-B_19961113_C1_ATC.mp3;http://www.xeno-canto.org/sounds/uploaded/AZXTZTQJRO/Chlorospingus_flavigularis_EC-PNP-B_19961113_C1_ATC.mp3;http://www.xeno-canto.org/sounds/uploaded/AZXTZTQJRO/ffts/tb/Chlorospingus_flavigularis_EC-PNP-B_19961113_C1_ATC.png
11040;Chlorospingus;flavigularis;Yellow-throated Bush Tanager;;Todd Mark;Peru;Caserio Sabanas, Rio Sta. Agueda drainage, Cajamarca;-4.8834;-78.8531;call;TMIItapeIIChloSpe.mp3;http://www.xeno-canto.org/sounds/uploaded/CLKPHLYUHA/TMIItapeIIChloSpe.mp3;http://www.xeno-canto.org/sounds/uploaded/CLKPHLYUHA/ffts/tb/TMIItapeIIChloSpe.png
50479;Chlorospingus;flavigularis;Yellow-throated Bush Tanager;;Manuel Sanchez N.;Ecuador;Chontayacu Area;;;dawn song calling;Yellow-throated Bush-Tanager.mp3;http://www.xeno-canto.org/sounds/uploaded/BBFFGHPZZQ/Yellow-throated Bush-Tanager.mp3;http://www.xeno-canto.org/sounds/uploaded/BBFFGHPZZQ/ffts/tb/Yellow-throated Bush-Tanager.png
55260;Chlorospingus;flavigularis;Yellow-throated Bush Tanager;;Bernabe Lopez-Lanus;Colombia;Reserva La Forzosa (Vereda Roble arriba), Anori, Antioquia;;;Call;Chlorospingus flavigularis_Reserva La Forzosa (vereda Roble arriba)_Anori_Antioquia_Colombia_4JUN2000 0900hs a_Bernabe Lopez-Lanus.mp3;http://www.xeno-canto.org/sounds/uploaded/BYLLSJRVDZ/Chlorospingus flavigularis_Reserva La Forzosa (vereda Roble arriba)_Anori_Antioquia_Colombia_4JUN2000 0900hs a_Bernabe Lopez-Lanus.mp3;http://www.xeno-canto.org/sounds/uploaded/BYLLSJRVDZ/ffts/tb/Chlorospingus flavigularis_Reserva La Forzosa (vereda Roble arriba)_Anori_Antioquia_Colombia_4JUN2000 0900hs a_Bernabe Lopez-Lanus.png
55261;Chlorospingus;flavigularis;Yellow-throated Bush Tanager;;Bernabe Lopez-Lanus;Colombia;Reserva La Forzosa (Vereda Roble arriba), Anori, Antioquia;;;Call;Chlorospingus flavigularis_Reserva La Forzosa (vereda Roble arriba)_Anori_Antioquia_Colombia_4JUN2000 0900hs c_Bernabe Lopez-Lanus.mp3;http://www.xeno-canto.org/sounds/uploaded/BYLLSJRVDZ/Chlorospingus flavigularis_Reserva La Forzosa (vereda Roble arriba)_Anori_Antioquia_Colombia_4JUN2000 0900hs c_Bernabe Lopez-Lanus.mp3;http://www.xeno-canto.org/sounds/uploaded/BYLLSJRVDZ/ffts/tb/Chlorospingus flavigularis_Reserva La Forzosa (vereda Roble arriba)_Anori_Antioquia_Colombia_4JUN2000 0900hs c_Bernabe Lopez-Lanus.png
55262;Chlorospingus;flavigularis;Yellow-throated Bush Tanager;;Bernabe Lopez-Lanus;Colombia;Reserva La Forzosa (Vereda Roble arriba), Anori, Antioquia;;;Call;Chlorospingus flavigularis_Reserva La Forzosa (vereda Roble arriba)_Anori_Antioquia_Colombia_4JUN2000 0900hs d_Bernabe Lopez-Lanus.mp3;http://www.xeno-canto.org/sounds/uploaded/BYLLSJRVDZ/Chlorospingus flavigularis_Reserva La Forzosa (vereda Roble arriba)_Anori_Antioquia_Colombia_4JUN2000 0900hs d_Bernabe Lopez-Lanus.mp3;http://www.xeno-canto.org/sounds/uploaded/BYLLSJRVDZ/ffts/tb/Chlorospingus flavigularis_Reserva La Forzosa (vereda Roble arriba)_Anori_Antioquia_Colombia_4JUN2000 0900hs d_Bernabe Lopez-Lanus.png
55263;Chlorospingus;flavigularis;Yellow-throated Bush Tanager;;Bernabe Lopez-Lanus;Colombia;Reserva La Forzosa (Vereda Roble arriba), Anori, Antioquia;;;Call;Chlorospingus flavigularis_Reserva La Forzosa (vereda Roble arriba)_Anori_Antioquia_Colombia_4JUN2000 0900hs e_Bernabe Lopez-Lanus.mp3;http://www.xeno-canto.org/sounds/uploaded/BYLLSJRVDZ/Chlorospingus flavigularis_Reserva La Forzosa (vereda Roble arriba)_Anori_Antioquia_Colombia_4JUN2000 0900hs e_Bernabe Lopez-Lanus.mp3;http://www.xeno-canto.org/sounds/uploaded/BYLLSJRVDZ/ffts/tb/Chlorospingus flavigularis_Reserva La Forzosa (vereda Roble arriba)_Anori_Antioquia_Colombia_4JUN2000 0900hs e_Bernabe Lopez-Lanus.png
57237;Chlorospingus;flavigularis;Yellow-throated Bush Tanager;flavigularis;David Geale;Peru;San Pedro, Manu Road, Cusco;-13.0501;-71.5564;Calls;chlfla01.mp3;http://www.xeno-canto.org/sounds/uploaded/SBFBVYGIJC/chlfla01.mp3;http://www.xeno-canto.org/sounds/uploaded/SBFBVYGIJC/ffts/tb/chlfla01.png
63282;Chlorospingus;flavigularis;Yellow-throated Bush Tanager;;Joseph Tobias and Nathalie Seddon;Peru;San Pedro (i.e. Cock of the Rock Lodge), Manu Road (1500-1700);-13.0501;-71.5564;call;Chlorospingusflav01.mp3;http://www.xeno-canto.org/sounds/uploaded/IKMWQIXRNV/Chlorospingusflav01.mp3;http://www.xeno-canto.org/sounds/uploaded/IKMWQIXRNV/ffts/tb/Chlorospingusflav01.png
63283;Chlorospingus;flavigularis;Yellow-throated Bush Tanager;;Joseph Tobias and Nathalie Seddon;Peru;San Pedro (i.e. Cock of the Rock Lodge), Manu Road (1500-1700);-13.0501;-71.5564;call;Chlorospingusflav02.mp3;http://www.xeno-canto.org/sounds/uploaded/IKMWQIXRNV/Chlorospingusflav02.mp3;http://www.xeno-canto.org/sounds/uploaded/IKMWQIXRNV/ffts/tb/Chlorospingusflav02.png
64095;Chlorospingus;flavigularis;Yellow-throated Bush Tanager;;David Geale;Peru;San Pedro, Manu Road, Cusco;-13.0501;-71.5564;Song;chlfla02.mp3;http://www.xeno-canto.org/sounds/uploaded/SBFBVYGIJC/chlfla02.mp3;http://www.xeno-canto.org/sounds/uploaded/SBFBVYGIJC/ffts/tb/chlfla02.png
67947;Chlorospingus;flavigularis;Yellow-throated Bush Tanager;;Frank Lambert;Peru;Cusco. Manu Road, below Cock-of-the-Rock Lodge;-13.1;-71.5;calls;Chlorospingus_flavigularis_2003b-FRL_PE_17_1667-1737_1_C.mp3;http://www.xeno-canto.org/sounds/uploaded/YTUXOCTUEM/Chlorospingus_flavigularis_2003b-FRL_PE_17_1667-1737_1_C.mp3;http://www.xeno-canto.org/sounds/uploaded/YTUXOCTUEM/ffts/tb/Chlorospingus_flavigularis_2003b-FRL_PE_17_1667-1737_1_C.png
74738;Chlorospingus;flavigularis;Yellow-throated Bush Tanager;;Daniel Lane;Ecuador;2.7km E Alto Tambo, Esmeraldas;0.892;-78.533;calls;Chlorospingus.flavigularis970728_9706-1.mp3;http://www.xeno-canto.org/sounds/uploaded/WOEAFQRMUD/Chlorospingus.flavigularis970728_9706-1.mp3;http://www.xeno-canto.org/sounds/uploaded/WOEAFQRMUD/ffts/tb/Chlorospingus.flavigularis970728_9706-1.png
74740;Chlorospingus;flavigularis;Yellow-throated Bush Tanager;;Daniel Lane;Ecuador;2.7km E Alto Tambo, Esmeraldas;0.892;-78.533;calls;Chlorospingus.flavigularis9706-2.mp3;http://www.xeno-canto.org/sounds/uploaded/WOEAFQRMUD/Chlorospingus.flavigularis9706-2.mp3;http://www.xeno-canto.org/sounds/uploaded/WOEAFQRMUD/ffts/tb/Chlorospingus.flavigularis9706-2.png
87823;Chlorospingus;flavigularis;Yellow-throated Bush Tanager;;David Geale;Peru;San Pedro, Manu Road;;;Call;YTBT2011sep211258.mp3;http://www.xeno-canto.org/sounds/uploaded/SBFBVYGIJC/YTBT2011sep211258.mp3;http://www.xeno-canto.org/sounds/uploaded/SBFBVYGIJC/ffts/tb/YTBT2011sep211258.png
98266;Chlorospingus;flavigularis;Yellow-throated Bush Tanager;flavigularis;Tayler Brooks;Ecuador;Wildsumaco, 5km NW Guagua Sumaco, Napo;-0.6873;-77.5992;Call;Yellow-throated Bush-Tanager call.mp3;http://www.xeno-canto.org/sounds/uploaded/ARFGONJCBJ/Yellow-throated Bush-Tanager call.mp3;http://www.xeno-canto.org/sounds/uploaded/ARFGONJCBJ/ffts/tb/Yellow-throated Bush-Tanager call.png
98267;Chlorospingus;flavigularis;Yellow-throated Bush Tanager;flavigularis;Tayler Brooks;Ecuador;Wildsumaco, 5km NW Guagua Sumaco, Napo;-0.6873;-77.5992;Song;Yellow-throated Bush-Tanager song.mp3;http://www.xeno-canto.org/sounds/uploaded/ARFGONJCBJ/Yellow-throated Bush-Tanager song.mp3;http://www.xeno-canto.org/sounds/uploaded/ARFGONJCBJ/ffts/tb/Yellow-throated Bush-Tanager song.png
