750;Diglossa;humeralis;Black Flowerpiercer;;Willem-Pier Vellinga;Peru;Bosque de Cuyas, Ayabaca, Piura;-4.6476;-79.74426;song;DigHumayabaca1-6dot23.mp3;http://www.xeno-canto.org/sounds/uploaded/AEFZWKWLMO/DigHumayabaca1-6dot23.mp3;http://www.xeno-canto.org/sounds/uploaded/AEFZWKWLMO/ffts/tb/DigHumayabaca1-6dot23.png
7862;Diglossa;humeralis;Black Flowerpiercer;;Todd Mark;Colombia;P. N. Purace, Huila;2.24611;-76.42167;song;DigHumIII.mp3;http://www.xeno-canto.org/sounds/uploaded/CLKPHLYUHA/DigHumIII.mp3;http://www.xeno-canto.org/sounds/uploaded/CLKPHLYUHA/ffts/tb/DigHumIII.png
11250;Diglossa;humeralis;Black Flowerpiercer;;Doug Knapp;Colombia;Bogota, Quebrada la Vieja;4.6231;-74.0562;Song;Diglossa_humeralis-DK-Col.mp3;http://www.xeno-canto.org/sounds/uploaded/BHRXQZEQFL/Diglossa_humeralis-DK-Col.mp3;http://www.xeno-canto.org/sounds/uploaded/BHRXQZEQFL/ffts/tb/Diglossa_humeralis-DK-Col.png
12565;Diglossa;humeralis;Black Flowerpiercer;;Oscar Laverde;Colombia;PNN Chingaza, sector Palacio;4.5167;-73.7501;song;17610.mp3;http://www.xeno-canto.org/sounds/uploaded/WKVKSVMNDZ/17610.mp3;http://www.xeno-canto.org/sounds/uploaded/WKVKSVMNDZ/ffts/tb/17610.png
36648;Diglossa;humeralis;Black Flowerpiercer;;Oswaldo Cortes;Colombia;Cerro de la Conejera (Bogota);4.7709;-74.0695;Songs;blackflowerpiercer 10203.mp3;http://www.xeno-canto.org/sounds/uploaded/VVDRVZCVWW/blackflowerpiercer 10203.mp3;http://www.xeno-canto.org/sounds/uploaded/VVDRVZCVWW/ffts/tb/blackflowerpiercer 10203.png
39202;Diglossa;humeralis;Black Flowerpiercer;;Oswaldo Cortes;Colombia;Parque Nacional Natural Chingaza;;;Songs;diglossa glossy7575649.mp3;http://www.xeno-canto.org/sounds/uploaded/VVDRVZCVWW/diglossa glossy7575649.mp3;http://www.xeno-canto.org/sounds/uploaded/VVDRVZCVWW/ffts/tb/diglossa glossy7575649.png
52718;Diglossa;humeralis;Black Flowerpiercer;;Bernabe Lopez-Lanus;Colombia;Finca La Selva (Quebrada San Jose), sobre Toche, Cajamarca, Tolima;;;Song;Diglossa humeralis_Quebrada San Jose_2742 m_Sobre Toche_Cajamarca_Tolima_Colombia_19AGO1998 b 9y 57_Bernabe Lopez-Lanus.mp3;http://www.xeno-canto.org/sounds/uploaded/BYLLSJRVDZ/Diglossa humeralis_Quebrada San Jose_2742 m_Sobre Toche_Cajamarca_Tolima_Colombia_19AGO1998 b 9y 57_Bernabe Lopez-Lanus.mp3;http://www.xeno-canto.org/sounds/uploaded/BYLLSJRVDZ/ffts/tb/Diglossa humeralis_Quebrada San Jose_2742 m_Sobre Toche_Cajamarca_Tolima_Colombia_19AGO1998 b 9y 57_Bernabe Lopez-Lanus.png
57462;Diglossa;humeralis;Black Flowerpiercer;;Bernabe Lopez-Lanus;Colombia;Humedal de Cordoba, Bogota, Cundinamarca;;;Song;Diglossa carbonaria_Humedal de Cordoba_Bogota_Cundinamarca_Colombia_10AGO2007 1015hs d_Bernabe Lopez-Lanus.mp3;http://www.xeno-canto.org/sounds/uploaded/BYLLSJRVDZ/Diglossa carbonaria_Humedal de Cordoba_Bogota_Cundinamarca_Colombia_10AGO2007 1015hs d_Bernabe Lopez-Lanus.mp3;http://www.xeno-canto.org/sounds/uploaded/BYLLSJRVDZ/ffts/tb/Diglossa carbonaria_Humedal de Cordoba_Bogota_Cundinamarca_Colombia_10AGO2007 1015hs d_Bernabe Lopez-Lanus.png
