10205;Diglossa;albilatera;White-sided Flowerpiercer;;Charles Hesse;Colombia;RNA El Dorado, Sierra de Santa Marta, Magdalena;11.1078;-74.0487;Song;061_WSFLP.mp3;http://www.xeno-canto.org/sounds/uploaded/FMQSRXIRTH/061_WSFLP.mp3;http://www.xeno-canto.org/sounds/uploaded/FMQSRXIRTH/ffts/tb/061_WSFLP.png
10618;Diglossa;albilatera;White-sided Flowerpiercer;;Todd Mark;Peru;Montana Negra: Camp IV, s. Cordillera del Condor, Cajamarca;-5.0714;-78.7125;trill;TMIItapeVIIDigAlb.mp3;http://www.xeno-canto.org/sounds/uploaded/CLKPHLYUHA/TMIItapeVIIDigAlb.mp3;http://www.xeno-canto.org/sounds/uploaded/CLKPHLYUHA/ffts/tb/TMIItapeVIIDigAlb.png
12361;Diglossa;albilatera;White-sided Flowerpiercer;;Oscar Laverde;Colombia;Ricaurte, RN La Planada, Narino;1.0834;-77.8834;song?;17159.mp3;http://www.xeno-canto.org/sounds/uploaded/WKVKSVMNDZ/17159.mp3;http://www.xeno-canto.org/sounds/uploaded/WKVKSVMNDZ/ffts/tb/17159.png
13303;Diglossa;albilatera;White-sided Flowerpiercer;albilatera;Roger Ahlman;Ecuador;Mindo, Pichincha;-0.0523;-78.7764;song;White-sided_Flowerpiercer2.mp3;http://www.xeno-canto.org/sounds/uploaded/EGHCOFEENE/White-sided_Flowerpiercer2.mp3;http://www.xeno-canto.org/sounds/uploaded/EGHCOFEENE/ffts/tb/White-sided_Flowerpiercer2.png
16009;Diglossa;albilatera;White-sided Flowerpiercer;albilatera;Nick Athanas;Colombia;RNA El Dorado, Sierra de Santa Marta, Magdalena;11.1078;-74.0487;song;R09_1185-White-sided-Flowerpiercer.mp3;http://www.xeno-canto.org/sounds/uploaded/XRABICUARW/R09_1185-White-sided-Flowerpiercer.mp3;http://www.xeno-canto.org/sounds/uploaded/XRABICUARW/ffts/tb/R09_1185-White-sided-Flowerpiercer.png
17560;Diglossa;albilatera;White-sided Flowerpiercer;albilatera;Andrew Spencer;Ecuador;Cabañas San Isidro, Cosanga, Napo;-0.5864;-77.8778;call;White-sided Flowerpiercer2008-1-12-1.mp3;http://www.xeno-canto.org/sounds/uploaded/CDTGHVBGZP/White-sided Flowerpiercer2008-1-12-1.mp3;http://www.xeno-canto.org/sounds/uploaded/CDTGHVBGZP/ffts/tb/White-sided Flowerpiercer2008-1-12-1.png
18075;Diglossa;albilatera;White-sided Flowerpiercer;;Herman van Oosten;Colombia;Sierra Nevada de Santa Marta, Magdalena;10.898042;-73.7677;calls while foraging;whsidedflowpierc_1410_30108.mp3;http://www.xeno-canto.org/sounds/uploaded/SNUDCZVUQK/whsidedflowpierc_1410_30108.mp3;http://www.xeno-canto.org/sounds/uploaded/SNUDCZVUQK/ffts/tb/whsidedflowpierc_1410_30108.png
18287;Diglossa;albilatera;White-sided Flowerpiercer;;Herman van Oosten;Colombia;R. N. Rio Blanco, Caldas;5.0834;-75.5001;common call/song;Diglossa albilatera_1120_11208.mp3;http://www.xeno-canto.org/sounds/uploaded/SNUDCZVUQK/Diglossa albilatera_1120_11208.mp3;http://www.xeno-canto.org/sounds/uploaded/SNUDCZVUQK/ffts/tb/Diglossa albilatera_1120_11208.png
24142;Diglossa;albilatera;White-sided Flowerpiercer;;Oswaldo Cortes;Colombia;Rogitama (Reserva Principe de Arcabuco);5.779625;-73.44635;Song;diglossa albilatera owc 005.mp3;http://www.xeno-canto.org/sounds/uploaded/VVDRVZCVWW/diglossa albilatera owc 005.mp3;http://www.xeno-canto.org/sounds/uploaded/VVDRVZCVWW/ffts/tb/diglossa albilatera owc 005.png
24143;Diglossa;albilatera;White-sided Flowerpiercer;;Oswaldo Cortes;Colombia;Rogitama (Reserva Principe de Arcabuco);5.779625;-73.44635;Song;diglossa albilatera owc 0020.mp3;http://www.xeno-canto.org/sounds/uploaded/VVDRVZCVWW/diglossa albilatera owc 0020.mp3;http://www.xeno-canto.org/sounds/uploaded/VVDRVZCVWW/ffts/tb/diglossa albilatera owc 0020.png
37557;Diglossa;albilatera;White-sided Flowerpiercer;;Oswaldo Cortes;Colombia;Parque Natural Chicaque;4.611331;-74.3153;Songs;Diglossa albilatera, basileuterus nigrocristatus, colibri thalassinus II.mp3;http://www.xeno-canto.org/sounds/uploaded/VVDRVZCVWW/Diglossa albilatera, basileuterus nigrocristatus, colibri thalassinus II.mp3;http://www.xeno-canto.org/sounds/uploaded/VVDRVZCVWW/ffts/tb/Diglossa albilatera, basileuterus nigrocristatus, colibri thalassinus II.png
37558;Diglossa;albilatera;White-sided Flowerpiercer;;Oswaldo Cortes;Colombia;Parque Natural Chicaque;4.611331;-74.3153;;Diglossa albilatera, basileuterus nigrocristatus, colibri thalassinus III.mp3;http://www.xeno-canto.org/sounds/uploaded/VVDRVZCVWW/Diglossa albilatera, basileuterus nigrocristatus, colibri thalassinus III.mp3;http://www.xeno-canto.org/sounds/uploaded/VVDRVZCVWW/ffts/tb/Diglossa albilatera, basileuterus nigrocristatus, colibri thalassinus III.png
37559;Diglossa;albilatera;White-sided Flowerpiercer;;Oswaldo Cortes;Colombia;Parque Natural Chicaque;4.611331;-74.3153;Songs;Diglossa albilatera, basileuterus nigrocristatus, colibri thalassinus IV.mp3;http://www.xeno-canto.org/sounds/uploaded/VVDRVZCVWW/Diglossa albilatera, basileuterus nigrocristatus, colibri thalassinus IV.mp3;http://www.xeno-canto.org/sounds/uploaded/VVDRVZCVWW/ffts/tb/Diglossa albilatera, basileuterus nigrocristatus, colibri thalassinus IV.png
37560;Diglossa;albilatera;White-sided Flowerpiercer;;Oswaldo Cortes;Colombia;Parque Natural Chicaque;4.611331;-74.3153;Songs;Diglossa albilatera, basileuterus nigrocristatus, colibri thalassinus.mp3;http://www.xeno-canto.org/sounds/uploaded/VVDRVZCVWW/Diglossa albilatera, basileuterus nigrocristatus, colibri thalassinus.mp3;http://www.xeno-canto.org/sounds/uploaded/VVDRVZCVWW/ffts/tb/Diglossa albilatera, basileuterus nigrocristatus, colibri thalassinus.png
37691;Diglossa;albilatera;White-sided Flowerpiercer;;Bob Planqué;Peru;La Granja minecamp, Chotas, Cajamarca;-6.35087717985125;-79.1158447181806;calls;WhitesidedFlowerpiercer_calls_LaGranja_040808_1300.mp3;http://www.xeno-canto.org/sounds/uploaded/OH38YHKJBS/WhitesidedFlowerpiercer_calls_LaGranja_040808_1300.mp3;http://www.xeno-canto.org/sounds/uploaded/OH38YHKJBS/ffts/tb/WhitesidedFlowerpiercer_calls_LaGranja_040808_1300.png
37731;Diglossa;albilatera;White-sided Flowerpiercer;;Bob Planqué;Peru;Bosque Paja Blanca, Chotas, Cajamarca;-6.3876;-79.1167;song;WhitesidedFlowerpiercer_song_PajaBlanca_080909_1200.mp3;http://www.xeno-canto.org/sounds/uploaded/OH38YHKJBS/WhitesidedFlowerpiercer_song_PajaBlanca_080909_1200.mp3;http://www.xeno-canto.org/sounds/uploaded/OH38YHKJBS/ffts/tb/WhitesidedFlowerpiercer_song_PajaBlanca_080909_1200.png
38794;Diglossa;albilatera;White-sided Flowerpiercer;;Frank Lambert;Ecuador;Reserva Tapichalaca, Valladolid, Zamora-Chinchipe;-4.4959;-79.1323;calls/song;FLOWERPWhiteSided_FL Tapichalaca19Dec05 2300m.mp3;http://www.xeno-canto.org/sounds/uploaded/YTUXOCTUEM/FLOWERPWhiteSided_FL Tapichalaca19Dec05 2300m.mp3;http://www.xeno-canto.org/sounds/uploaded/YTUXOCTUEM/ffts/tb/FLOWERPWhiteSided_FL Tapichalaca19Dec05 2300m.png
41459;Diglossa;albilatera;White-sided Flowerpiercer;;Oswaldo Cortes;Colombia;Aurora Alta_Bogota;;;songs;albilatera554747373.mp3;http://www.xeno-canto.org/sounds/uploaded/VVDRVZCVWW/albilatera554747373.mp3;http://www.xeno-canto.org/sounds/uploaded/VVDRVZCVWW/ffts/tb/albilatera554747373.png
47381;Diglossa;albilatera;White-sided Flowerpiercer;affinis;Niels Krabbe;Peru;Paty Trail, Huanuco;-9.6334;-76.1334;song;Diglossa_albilatera_affinis,_Pati_trail,_Huanuco,_0941S_7606W,_2400_m,_09_Aug_1983,_NKrabbe,_song.mp3;http://www.xeno-canto.org/sounds/uploaded/XTVEPHMPPJ/Diglossa_albilatera_affinis,_Pati_trail,_Huanuco,_0941S_7606W,_2400_m,_09_Aug_1983,_NKrabbe,_song.mp3;http://www.xeno-canto.org/sounds/uploaded/XTVEPHMPPJ/ffts/tb/Diglossa_albilatera_affinis,_Pati_trail,_Huanuco,_0941S_7606W,_2400_m,_09_Aug_1983,_NKrabbe,_song.png
50446;Diglossa;albilatera;White-sided Flowerpiercer;;Bernabe Lopez-Lanus;Ecuador;Utuana, Canton Calvas, Loja;-4.364555;-79.705811;Female alarm call;Diglossa albilatera hembra_Utuana_Canton Calvas_Loja_Ecuador_24ABR1998 c_Bernabe Lopez-Lanus.mp3;http://www.xeno-canto.org/sounds/uploaded/BYLLSJRVDZ/Diglossa albilatera hembra_Utuana_Canton Calvas_Loja_Ecuador_24ABR1998 c_Bernabe Lopez-Lanus.mp3;http://www.xeno-canto.org/sounds/uploaded/BYLLSJRVDZ/ffts/tb/Diglossa albilatera hembra_Utuana_Canton Calvas_Loja_Ecuador_24ABR1998 c_Bernabe Lopez-Lanus.png
51310;Diglossa;albilatera;White-sided Flowerpiercer;;Bernabe Lopez-Lanus;Colombia;Hacienda Las Cruces (Area La Ceja), Toche, Municipio Ibague, Tolima;;;Song;Diglossa albilatera_Hacienda Las Cruces_Canon del Rio Toche_Toche_Tolima_Colombia_19JUN1998 zz_Bernabe Lopez-Lanus.mp3;http://www.xeno-canto.org/sounds/uploaded/BYLLSJRVDZ/Diglossa albilatera_Hacienda Las Cruces_Canon del Rio Toche_Toche_Tolima_Colombia_19JUN1998 zz_Bernabe Lopez-Lanus.mp3;http://www.xeno-canto.org/sounds/uploaded/BYLLSJRVDZ/ffts/tb/Diglossa albilatera_Hacienda Las Cruces_Canon del Rio Toche_Toche_Tolima_Colombia_19JUN1998 zz_Bernabe Lopez-Lanus.png
51443;Diglossa;albilatera;White-sided Flowerpiercer;;Bernabe Lopez-Lanus;Colombia;Hacienda Las Cruces (Area La Ceja), Toche, Municipio Ibague, Tolima;;;Song;Diglossa albilatera_Finca Yerbabuenal_Canon del Rio Toche_Toche_Tolima_Colombia_22JUN1998 a_Bernabe Lopez-Lanus.mp3;http://www.xeno-canto.org/sounds/uploaded/BYLLSJRVDZ/Diglossa albilatera_Finca Yerbabuenal_Canon del Rio Toche_Toche_Tolima_Colombia_22JUN1998 a_Bernabe Lopez-Lanus.mp3;http://www.xeno-canto.org/sounds/uploaded/BYLLSJRVDZ/ffts/tb/Diglossa albilatera_Finca Yerbabuenal_Canon del Rio Toche_Toche_Tolima_Colombia_22JUN1998 a_Bernabe Lopez-Lanus.png
53424;Diglossa;albilatera;White-sided Flowerpiercer;;Bernabe Lopez-Lanus;Colombia;Finca La Carbonera (canon del rio Toche), Tolima;;;Song;Diglossa albilatera_Finca Yerbabuenal (sobreToche)_Cajamarca_Tolima_Colombia_5NOV1998_1630HS b_Bernabe Lopez-Lanus.mp3;http://www.xeno-canto.org/sounds/uploaded/BYLLSJRVDZ/Diglossa albilatera_Finca Yerbabuenal (sobreToche)_Cajamarca_Tolima_Colombia_5NOV1998_1630HS b_Bernabe Lopez-Lanus.mp3;http://www.xeno-canto.org/sounds/uploaded/BYLLSJRVDZ/ffts/tb/Diglossa albilatera_Finca Yerbabuenal (sobreToche)_Cajamarca_Tolima_Colombia_5NOV1998_1630HS b_Bernabe Lopez-Lanus.png
54294;Diglossa;albilatera;White-sided Flowerpiercer;;Bernabe Lopez-Lanus;Colombia;Roncesvalles, Tolima;;;Song;Diglossa albilatera_Filo de Cholo_Finca La Rivera_Roncesvalles_Tolima_6ENE2000 g_Bernabe Lopez-Lanus.mp3;http://www.xeno-canto.org/sounds/uploaded/BYLLSJRVDZ/Diglossa albilatera_Filo de Cholo_Finca La Rivera_Roncesvalles_Tolima_6ENE2000 g_Bernabe Lopez-Lanus.mp3;http://www.xeno-canto.org/sounds/uploaded/BYLLSJRVDZ/ffts/tb/Diglossa albilatera_Filo de Cholo_Finca La Rivera_Roncesvalles_Tolima_6ENE2000 g_Bernabe Lopez-Lanus.png
56384;Diglossa;albilatera;White-sided Flowerpiercer;;Bernabe Lopez-Lanus;Colombia;Entre La Romelia y El Planchon (PNN Munchique), Charguayaco, Vereda La Romelia, Mpio El Tambo, Cauca;;;Song;Diglossa albilatera_La Romelia-El Planchon_PN Munchique_El Tambo_Cauca_Colombia_29SEP2000 0729hs h_Bernabe Lopez-Lanus.mp3;http://www.xeno-canto.org/sounds/uploaded/BYLLSJRVDZ/Diglossa albilatera_La Romelia-El Planchon_PN Munchique_El Tambo_Cauca_Colombia_29SEP2000 0729hs h_Bernabe Lopez-Lanus.mp3;http://www.xeno-canto.org/sounds/uploaded/BYLLSJRVDZ/ffts/tb/Diglossa albilatera_La Romelia-El Planchon_PN Munchique_El Tambo_Cauca_Colombia_29SEP2000 0729hs h_Bernabe Lopez-Lanus.png
56435;Diglossa;albilatera;White-sided Flowerpiercer;;Bernabe Lopez-Lanus;Colombia;Entre La Romelia y El Planchon (PNN Munchique), Charguayaco, Vereda La Romelia, Mpio El Tambo, Cauca;;;Call;Diglossa albilatera_La Romelia-El Planchon_PN Munchique_El Tambo_Cauca_Colombia_30SEP2000 0740 hs n_Bernabe Lopez-Lanus.mp3;http://www.xeno-canto.org/sounds/uploaded/BYLLSJRVDZ/Diglossa albilatera_La Romelia-El Planchon_PN Munchique_El Tambo_Cauca_Colombia_30SEP2000 0740 hs n_Bernabe Lopez-Lanus.mp3;http://www.xeno-canto.org/sounds/uploaded/BYLLSJRVDZ/ffts/tb/Diglossa albilatera_La Romelia-El Planchon_PN Munchique_El Tambo_Cauca_Colombia_30SEP2000 0740 hs n_Bernabe Lopez-Lanus.png
59633;Diglossa;albilatera;White-sided Flowerpiercer;;Frank Lambert;Colombia;Parque Natural Munchique, sector Romelia;;;trill;Diglossa_albilatera-FL (not seen - 90percent) Munchique 4Feb2010 2500m R09_0247.mp3;http://www.xeno-canto.org/sounds/uploaded/YTUXOCTUEM/Diglossa_albilatera-FL (not seen - 90percent) Munchique 4Feb2010 2500m R09_0247.mp3;http://www.xeno-canto.org/sounds/uploaded/YTUXOCTUEM/ffts/tb/Diglossa_albilatera-FL (not seen - 90percent) Munchique 4Feb2010 2500m R09_0247.png
91766;Diglossa;albilatera;White-sided Flowerpiercer;;Oswaldo Cortes;Colombia;Rogitama (Reserva Principe de Arcabuco);5.7795;-73.4462;songs;diglossa albilatera rogitama 2.mp3;http://www.xeno-canto.org/sounds/uploaded/VVDRVZCVWW/diglossa albilatera rogitama 2.mp3;http://www.xeno-canto.org/sounds/uploaded/VVDRVZCVWW/ffts/tb/diglossa albilatera rogitama 2.png
91768;Diglossa;albilatera;White-sided Flowerpiercer;;Oswaldo Cortes;Colombia;Rogitama (Reserva Principe de Arcabuco);5.7795;-73.4462;songs;diglossa albilatera rogitama.mp3;http://www.xeno-canto.org/sounds/uploaded/VVDRVZCVWW/diglossa albilatera rogitama.mp3;http://www.xeno-canto.org/sounds/uploaded/VVDRVZCVWW/ffts/tb/diglossa albilatera rogitama.png
95909;Diglossa;albilatera;White-sided Flowerpiercer;;Oswaldo Cortes;Colombia;Reserva Natural Mesenia - Paramillo;5.4828;-75.8959;songs;Diglossa labilatera jardin 1.mp3;http://www.xeno-canto.org/sounds/uploaded/VVDRVZCVWW/Diglossa labilatera jardin 1.mp3;http://www.xeno-canto.org/sounds/uploaded/VVDRVZCVWW/ffts/tb/Diglossa labilatera jardin 1.png
