37801;Garrulax;sannio;White-browed Laughingthrush;;Liao Xiao-dong;China;Xiangqiao Luzai GuangXi Province;;;call;baijia2009_02_10.mp3;http://www.xeno-canto.org/sounds/uploaded/ALPFUPDEQQ/baijia2009_02_10.mp3;http://www.xeno-canto.org/sounds/uploaded/ALPFUPDEQQ/ffts/tb/baijia2009_02_10.png
40960;Garrulax;sannio;White-browed Laughingthrush;;Brian Cox;Vietnam;Sapa Botanical Gardens;22.3353;103.8514;call;white browed Laughingthrush and strk brstd Scim babr Sapa.mp3;http://www.xeno-canto.org/sounds/uploaded/OKSKESEOLP/white browed Laughingthrush and strk brstd Scim babr Sapa.mp3;http://www.xeno-canto.org/sounds/uploaded/OKSKESEOLP/ffts/tb/white browed Laughingthrush and strk brstd Scim babr Sapa.png
68388;Garrulax;sannio;White-browed Laughingthrush;;Frank Lambert;Vietnam;Tonkin. Fansipan Mts., near Sapa, O Qui Ho;22.3;103.8;call;Garrulax_sannio_Vietnam-97.1a-FRL_VN_23_1560-1596.2_C.mp3;http://www.xeno-canto.org/sounds/uploaded/YTUXOCTUEM/Garrulax_sannio_Vietnam-97.1a-FRL_VN_23_1560-1596.2_C.mp3;http://www.xeno-canto.org/sounds/uploaded/YTUXOCTUEM/ffts/tb/Garrulax_sannio_Vietnam-97.1a-FRL_VN_23_1560-1596.2_C.png
89834;Garrulax;sannio;White-browed Laughingthrush;comis;Frank Lambert;Myanmar;near Kalau (FL);20.62;96.542;calls;Garrulax_sannio_comis-FL song nr Kalau 20Jan11 1530m R09_0176.mp3;http://www.xeno-canto.org/sounds/uploaded/YTUXOCTUEM/Garrulax_sannio_comis-FL song nr Kalau 20Jan11 1530m R09_0176.mp3;http://www.xeno-canto.org/sounds/uploaded/YTUXOCTUEM/ffts/tb/Garrulax_sannio_comis-FL song nr Kalau 20Jan11 1530m R09_0176.png
81389;Garrulax;sannio;White-browed Laughingthrush;;Jonathan Martinez;China;Hunan province,Yueyang,  Yunxi;29.42;113.219;group call;White-browedLaughingthrush(Pterorhinussannio)groupcall100610-000ChinaHunanYueyangJM.mp3;http://www.xeno-canto.org/sounds/uploaded/JZARYPSBFA/White-browedLaughingthrush(Pterorhinussannio)groupcall100610-000ChinaHunanYueyangJM.mp3;http://www.xeno-canto.org/sounds/uploaded/JZARYPSBFA/ffts/tb/White-browedLaughingthrush(Pterorhinussannio)groupcall100610-000ChinaHunanYueyangJM.png
81404;Garrulax;sannio;White-browed Laughingthrush;;Jonathan Martinez;China;Hunan province,Yueyang,  Yunxi;29.42;113.219;call;WhitebrowedLaughingthrushcall100613-005ChinaHunanYueyangJM.mp3;http://www.xeno-canto.org/sounds/uploaded/JZARYPSBFA/WhitebrowedLaughingthrushcall100613-005ChinaHunanYueyangJM.mp3;http://www.xeno-canto.org/sounds/uploaded/JZARYPSBFA/ffts/tb/WhitebrowedLaughingthrushcall100613-005ChinaHunanYueyangJM.png
