12117;Oreoscoptes;montanus;Sage Thrasher;;Nathan Pieplow;United States;Mack, Mesa County, Colorado;39.22387;-108.8651;song;NDP2007-SATHs-Mack-Mesa-CO-4-7.mp3;http://www.xeno-canto.org/sounds/uploaded/EKKJJJRDJY/NDP2007-SATHs-Mack-Mesa-CO-4-7.mp3;http://www.xeno-canto.org/sounds/uploaded/EKKJJJRDJY/ffts/tb/NDP2007-SATHs-Mack-Mesa-CO-4-7.png
12118;Oreoscoptes;montanus;Sage Thrasher;;Nathan Pieplow;United States;Mack, Mesa County, Colorado;39.22387;-108.8651;song;NDP2007-SATHsShrt-Mack-Mesa-CO-4-7.mp3;http://www.xeno-canto.org/sounds/uploaded/EKKJJJRDJY/NDP2007-SATHsShrt-Mack-Mesa-CO-4-7.mp3;http://www.xeno-canto.org/sounds/uploaded/EKKJJJRDJY/ffts/tb/NDP2007-SATHsShrt-Mack-Mesa-CO-4-7.png
13840;Oreoscoptes;montanus;Sage Thrasher;;Andrew Spencer;United States;Moffat County, Colorado;40.64997;-108.08397;song;SATH2007-6-4-1.mp3;http://www.xeno-canto.org/sounds/uploaded/CDTGHVBGZP/SATH2007-6-4-1.mp3;http://www.xeno-canto.org/sounds/uploaded/CDTGHVBGZP/ffts/tb/SATH2007-6-4-1.png
13841;Oreoscoptes;montanus;Sage Thrasher;;Andrew Spencer;United States;Moffat County, Colorado;40.64997;-108.08397;song;SATH2007-6-4-3.mp3;http://www.xeno-canto.org/sounds/uploaded/CDTGHVBGZP/SATH2007-6-4-3.mp3;http://www.xeno-canto.org/sounds/uploaded/CDTGHVBGZP/ffts/tb/SATH2007-6-4-3.png
34808;Oreoscoptes;montanus;Sage Thrasher;;Andrew Spencer;United States;Paradox Valley, Montrose Co., Colorado;38.3303;-108.9159;calls;SATH2008-4-12calls1.mp3;http://www.xeno-canto.org/sounds/uploaded/CDTGHVBGZP/SATH2008-4-12calls1.mp3;http://www.xeno-canto.org/sounds/uploaded/CDTGHVBGZP/ffts/tb/SATH2008-4-12calls1.png
54377;Oreoscoptes;montanus;Sage Thrasher;;Mike Nelson;United States;NW Walden, Jackson Co, CO;40.8353;-106.4495;Song;SageThrasher1.mp3;http://www.xeno-canto.org/sounds/uploaded/PWDLINYMKL/SageThrasher1.mp3;http://www.xeno-canto.org/sounds/uploaded/PWDLINYMKL/ffts/tb/SageThrasher1.png
65359;Oreoscoptes;montanus;Sage Thrasher;;Eric DeFonso;United States;Marble Hot Springs Rd, Plumas Cty, CA;39.764;-120.354;song;20100613-0955-DREW1019-US-CA-Plumas-Marble Hot Spgs Rd-Sage Thrasher songs+.mp3;http://www.xeno-canto.org/sounds/uploaded/KTLCZCRCQX/20100613-0955-DREW1019-US-CA-Plumas-Marble Hot Spgs Rd-Sage Thrasher songs+.mp3;http://www.xeno-canto.org/sounds/uploaded/KTLCZCRCQX/ffts/tb/20100613-0955-DREW1019-US-CA-Plumas-Marble Hot Spgs Rd-Sage Thrasher songs+.png
75118;Oreoscoptes;montanus;Sage Thrasher;;Ryan P. O'Donnell;United States;Montezuma Creek Canyon, San Juan County, Utah;37.468;-109.224;Song;0114 Sage Thrasher.mp3;http://www.xeno-canto.org/sounds/uploaded/SDXVTLDNGJ/0114 Sage Thrasher.mp3;http://www.xeno-canto.org/sounds/uploaded/SDXVTLDNGJ/ffts/tb/0114 Sage Thrasher.png
