19162;Pellorneum;capistratum;Black-capped Babbler;;Craig Robson;Malaysia;Danum Valley, Sabah, Borneo;4.9767;117.7417;song;Black-cappedBabblerRobson.mp3;http://www.xeno-canto.org/sounds/uploaded/FKYXAHGMVM/Black-cappedBabblerRobson.mp3;http://www.xeno-canto.org/sounds/uploaded/FKYXAHGMVM/ffts/tb/Black-cappedBabblerRobson.png
20284;Pellorneum;capistratum;Black-capped Babbler;;Sander Pieterse  and  Ben Wielstra;Indonesia;Pinang Jatus, Gunung Lumut Protection Forest, East Kalimantan, Borneo;-1.3806;116.1306;song;2005_east_kalimantan_-_black-capped_babbler_1_64kbps_edit.mp3;http://www.xeno-canto.org/sounds/uploaded/HMLZGZJENG/2005_east_kalimantan_-_black-capped_babbler_1_64kbps_edit.mp3;http://www.xeno-canto.org/sounds/uploaded/HMLZGZJENG/ffts/tb/2005_east_kalimantan_-_black-capped_babbler_1_64kbps_edit.png
26965;Pellorneum;capistratum;Black-capped Babbler;;Sander Pieterse  and  Ben Wielstra;Indonesia;Sungai Wain Protection Forest, East Kalimantan, Borneo;-1.1167;116.8167;song (5-note variant);2005_east_kalimantan_-_black-capped_babbler_3.mp3;http://www.xeno-canto.org/sounds/uploaded/HMLZGZJENG/2005_east_kalimantan_-_black-capped_babbler_3.mp3;http://www.xeno-canto.org/sounds/uploaded/HMLZGZJENG/ffts/tb/2005_east_kalimantan_-_black-capped_babbler_3.png
26971;Pellorneum;capistratum;Black-capped Babbler;;Sander Pieterse  and  Ben Wielstra;Indonesia;Sungai Wain Protection Forest, East Kalimantan, Borneo;-1.1167;116.8167;song, calls;2005_east_kalimantan_-_black-capped_babbler_4.mp3;http://www.xeno-canto.org/sounds/uploaded/HMLZGZJENG/2005_east_kalimantan_-_black-capped_babbler_4.mp3;http://www.xeno-canto.org/sounds/uploaded/HMLZGZJENG/ffts/tb/2005_east_kalimantan_-_black-capped_babbler_4.png
27642;Pellorneum;capistratum;Black-capped Babbler;;David Edwards;Malaysia;Danum Valley, Sabah, Borneo;4.9767;117.7417;song;Grey-headedBabblerDanum08Edwards.mp3;http://www.xeno-canto.org/sounds/uploaded/AFEHYCAHZR/Grey-headedBabblerDanum08Edwards.mp3;http://www.xeno-canto.org/sounds/uploaded/AFEHYCAHZR/ffts/tb/Grey-headedBabblerDanum08Edwards.png
29589;Pellorneum;capistratum;Black-capped Babbler;;Patrik Åberg;Thailand;Khao Nor Chu Chi, Krabi;7.9212;99.2664;;Black-Capped_Babbler_Khao_Nor_Chor_chi.mp3;http://www.xeno-canto.org/sounds/uploaded/BPSDQEOJWG/Black-Capped_Babbler_Khao_Nor_Chor_chi.mp3;http://www.xeno-canto.org/sounds/uploaded/BPSDQEOJWG/ffts/tb/Black-Capped_Babbler_Khao_Nor_Chor_chi.png
29902;Pellorneum;capistratum;Black-capped Babbler;;David Edwards;Malaysia;Malua Forest Reserve, Sabah, Borneo;5.172;117.6345;song;Black-cappedBabblerMalua08Edwards.mp3;http://www.xeno-canto.org/sounds/uploaded/AFEHYCAHZR/Black-cappedBabblerMalua08Edwards.mp3;http://www.xeno-canto.org/sounds/uploaded/AFEHYCAHZR/ffts/tb/Black-cappedBabblerMalua08Edwards.png
29970;Pellorneum;capistratum;Black-capped Babbler;;David Edwards;Malaysia;Danum Valley, Sabah, Borneo;4.9767;117.7417;song;Grey-headedBabbler2Danum08Edwards.mp3;http://www.xeno-canto.org/sounds/uploaded/AFEHYCAHZR/Grey-headedBabbler2Danum08Edwards.mp3;http://www.xeno-canto.org/sounds/uploaded/AFEHYCAHZR/ffts/tb/Grey-headedBabbler2Danum08Edwards.png
29971;Pellorneum;capistratum;Black-capped Babbler;;David Edwards;Malaysia;Danum Valley, Sabah, Borneo;4.9767;117.7417;song;Grey-headedBabbler3Danum08Edwards.mp3;http://www.xeno-canto.org/sounds/uploaded/AFEHYCAHZR/Grey-headedBabbler3Danum08Edwards.mp3;http://www.xeno-canto.org/sounds/uploaded/AFEHYCAHZR/ffts/tb/Grey-headedBabbler3Danum08Edwards.png
34469;Pellorneum;capistratum;Black-capped Babbler;morrelli;Tjalle Boorsma;Indonesia;Pinang Jatus, Gunung Lumut Protection Forest, East Kalimantan, Borneo;-1.3806;116.1306;Song;071. Black capped Babbler (Song, 115).mp3;http://www.xeno-canto.org/sounds/uploaded/YXENFOVUZX/071. Black capped Babbler (Song, 115).mp3;http://www.xeno-canto.org/sounds/uploaded/YXENFOVUZX/ffts/tb/071. Black capped Babbler (Song, 115).png
34470;Pellorneum;capistratum;Black-capped Babbler;morrelli;Tjalle Boorsma;Indonesia;Swanslutung, Gunung Lumut Protection Forest, East Kalimantan, Borneo;-1.4001;115.8667;Song;072. Black-capped Babbler (Song).mp3;http://www.xeno-canto.org/sounds/uploaded/YXENFOVUZX/072. Black-capped Babbler (Song).mp3;http://www.xeno-canto.org/sounds/uploaded/YXENFOVUZX/ffts/tb/072. Black-capped Babbler (Song).png
35884;Pellorneum;capistratum;Black-capped Babbler;morrelli;Arnold Meijer;Malaysia;Danum Valley Field Centre, Danum Valley, Sabah, Borneo;4.9634;117.8028;song;Black-capped Babbler (Pellorneum capistratum), ssp. morrelli. Song..mp3;http://www.xeno-canto.org/sounds/uploaded/UXOKEACNUT/Black-capped Babbler (Pellorneum capistratum), ssp. morrelli. Song..mp3;http://www.xeno-canto.org/sounds/uploaded/UXOKEACNUT/ffts/tb/Black-capped Babbler (Pellorneum capistratum), ssp. morrelli. Song..png
39493;Pellorneum;capistratum;Black-capped Babbler;capistratum;Brian Cox;Indonesia;Carita, Java;;;song;black capped babbler carita.mp3;http://www.xeno-canto.org/sounds/uploaded/OKSKESEOLP/black capped babbler carita.mp3;http://www.xeno-canto.org/sounds/uploaded/OKSKESEOLP/ffts/tb/black capped babbler carita.png
39494;Pellorneum;capistratum;Black-capped Babbler;capistratum;Brian Cox;Indonesia;Carita, Java;;;call;black capped babbler Carita 2.mp3;http://www.xeno-canto.org/sounds/uploaded/OKSKESEOLP/black capped babbler Carita 2.mp3;http://www.xeno-canto.org/sounds/uploaded/OKSKESEOLP/ffts/tb/black capped babbler Carita 2.png
40402;Pellorneum;capistratum;Black-capped Babbler;;David Edwards;Malaysia;Danum Valley, Sabah, Borneo;4.9767;117.7417;song;Black-cappedBabblerDanum09Edwards.mp3;http://www.xeno-canto.org/sounds/uploaded/AFEHYCAHZR/Black-cappedBabblerDanum09Edwards.mp3;http://www.xeno-canto.org/sounds/uploaded/AFEHYCAHZR/ffts/tb/Black-cappedBabblerDanum09Edwards.png
45119;Pellorneum;capistratum;Black-capped Babbler;;Yeap Soon Pin;Malaysia;Bukit Rengit, Pahang;3.53754523527158;102.167083744425;Call;Black-capped_Babbler_Rengit.mp3;http://www.xeno-canto.org/sounds/uploaded/VYGNPLKAOJ/Black-capped_Babbler_Rengit.mp3;http://www.xeno-canto.org/sounds/uploaded/VYGNPLKAOJ/ffts/tb/Black-capped_Babbler_Rengit.png
46538;Pellorneum;capistratum;Black-capped Babbler;morrelli;Mike Nelson;Malaysia;Rainforest Discovery Center, Sepilok, Sabah, Borneo;5.8762;117.9448;Song;BlackcappedBabbler.mp3;http://www.xeno-canto.org/sounds/uploaded/PWDLINYMKL/BlackcappedBabbler.mp3;http://www.xeno-canto.org/sounds/uploaded/PWDLINYMKL/ffts/tb/BlackcappedBabbler.png
56872;Pellorneum;capistratum;Black-capped Babbler;morrelli;Fabian Ducry  and  David Marques;Malaysia;Rainforest Discovery Center, Sepilok, Sabah, Borneo;5.8762;117.9448;song;20090710_SepilokRDC_Black-cappedBabbler_1.mp3;http://www.xeno-canto.org/sounds/uploaded/VLLMNTIBZB/20090710_SepilokRDC_Black-cappedBabbler_1.mp3;http://www.xeno-canto.org/sounds/uploaded/VLLMNTIBZB/ffts/tb/20090710_SepilokRDC_Black-cappedBabbler_1.png
64647;Pellorneum;capistratum;Black-capped Babbler;;Iain Woxvold;Indonesia;Upper Maruwai catchment, Central Kalimantan;-0.1126;114.8556;Song;Black-capped_Babbler_IW1.mp3;http://www.xeno-canto.org/sounds/uploaded/IASEWSJZCS/Black-capped_Babbler_IW1.mp3;http://www.xeno-canto.org/sounds/uploaded/IASEWSJZCS/ffts/tb/Black-capped_Babbler_IW1.png
64648;Pellorneum;capistratum;Black-capped Babbler;;Iain Woxvold;Indonesia;Empakuq, East Kalimantan;-0.2814;115.8559;Song;Black-capped_Babbler_IW2.mp3;http://www.xeno-canto.org/sounds/uploaded/IASEWSJZCS/Black-capped_Babbler_IW2.mp3;http://www.xeno-canto.org/sounds/uploaded/IASEWSJZCS/ffts/tb/Black-capped_Babbler_IW2.png
65324;Pellorneum;capistratum;Black-capped Babbler;nigrocapitatum;Rolf A. de By;Malaysia;Johor, Panti Forest Reserve, Bunker Trail;1.8773;103.9184;song;rdb2010_1023_100434.mp3;http://www.xeno-canto.org/sounds/uploaded/PTYTXQRLSZ/rdb2010_1023_100434.mp3;http://www.xeno-canto.org/sounds/uploaded/PTYTXQRLSZ/ffts/tb/rdb2010_1023_100434.png
65533;Pellorneum;capistratum;Black-capped Babbler;nigrocapitatum;Sander Pieterse;Malaysia;Taman Negara, Pahang;4.3864;102.4017;song?;SP_Malaysia_2010_-_Black-capped_Babbler_song_(Taman_Negara).mp3;http://www.xeno-canto.org/sounds/uploaded/HMLZGZJENG/SP_Malaysia_2010_-_Black-capped_Babbler_song_(Taman_Negara).mp3;http://www.xeno-canto.org/sounds/uploaded/HMLZGZJENG/ffts/tb/SP_Malaysia_2010_-_Black-capped_Babbler_song_(Taman_Negara).png
68992;Pellorneum;capistratum;Black-capped Babbler;;Frank Lambert;Malaysia;Sabah;5;117;song;Pellorneum_capistratum_Sabah.1a-FRL_MY_1_6-38_1_S.mp3;http://www.xeno-canto.org/sounds/uploaded/YTUXOCTUEM/Pellorneum_capistratum_Sabah.1a-FRL_MY_1_6-38_1_S.mp3;http://www.xeno-canto.org/sounds/uploaded/YTUXOCTUEM/ffts/tb/Pellorneum_capistratum_Sabah.1a-FRL_MY_1_6-38_1_S.png
70179;Pellorneum;capistratum;Black-capped Babbler;capistratum;David Gibbs;Indonesia;Java, Ujung Kolong, Cigenter;-6.7528;105.4028;song;Black-capped_Babbler.mp3;http://www.xeno-canto.org/sounds/uploaded/MVICEJYJCV/Black-capped_Babbler.mp3;http://www.xeno-canto.org/sounds/uploaded/MVICEJYJCV/ffts/tb/Black-capped_Babbler.png
70583;Pellorneum;capistratum;Black-capped Babbler;;David Edwards;Malaysia;Danum Valley, Sabah, Borneo;4.9767;117.7417;song;Black-cappedBabbler_Danum2010_Edwards.mp3;http://www.xeno-canto.org/sounds/uploaded/AFEHYCAHZR/Black-cappedBabbler_Danum2010_Edwards.mp3;http://www.xeno-canto.org/sounds/uploaded/AFEHYCAHZR/ffts/tb/Black-cappedBabbler_Danum2010_Edwards.png
70586;Pellorneum;capistratum;Black-capped Babbler;;David Edwards;Malaysia;SAFE project, Sabah, Borneo;4.675;117.5784;song;Black-cappedBabbler3_SAFE2010_Edwards.mp3;http://www.xeno-canto.org/sounds/uploaded/AFEHYCAHZR/Black-cappedBabbler3_SAFE2010_Edwards.mp3;http://www.xeno-canto.org/sounds/uploaded/AFEHYCAHZR/ffts/tb/Black-cappedBabbler3_SAFE2010_Edwards.png
71650;Pellorneum;capistratum;Black-capped Babbler;nigrocapitatum;Bas van Balen;Indonesia;Martabe, North Sumatra;;;call;Pellcapi_27vi03_815_174B499.mp3;http://www.xeno-canto.org/sounds/uploaded/VSXHBVQJDA/Pellcapi_27vi03_815_174B499.mp3;http://www.xeno-canto.org/sounds/uploaded/VSXHBVQJDA/ffts/tb/Pellcapi_27vi03_815_174B499.png
90171;Pellorneum;capistratum;Black-capped Babbler;nigrocapitatum;Frank Lambert;Malaysia;Ulu Mudah, Kedah (nr Earth Lodge);6.1151;100.9634;calls;Pellorneum_capistratum_nigrocapitatum-FL X calls UluMuda Kedah MY 14Nov11 R05_0177.mp3;http://www.xeno-canto.org/sounds/uploaded/YTUXOCTUEM/Pellorneum_capistratum_nigrocapitatum-FL X calls UluMuda Kedah MY 14Nov11 R05_0177.mp3;http://www.xeno-canto.org/sounds/uploaded/YTUXOCTUEM/ffts/tb/Pellorneum_capistratum_nigrocapitatum-FL X calls UluMuda Kedah MY 14Nov11 R05_0177.png
90213;Pellorneum;capistratum;Black-capped Babbler;nigrocapitatum;Frank Lambert;Malaysia;Ulu Mudah, Kedah (nr Earth Lodge);6.1151;100.9634;song;Pellorneum_capistratum_nigrocapitatum-FL X calls UluMuda Kedah MY 14Nov11 R05_0154.mp3;http://www.xeno-canto.org/sounds/uploaded/YTUXOCTUEM/Pellorneum_capistratum_nigrocapitatum-FL X calls UluMuda Kedah MY 14Nov11 R05_0154.mp3;http://www.xeno-canto.org/sounds/uploaded/YTUXOCTUEM/ffts/tb/Pellorneum_capistratum_nigrocapitatum-FL X calls UluMuda Kedah MY 14Nov11 R05_0154.png
90214;Pellorneum;capistratum;Black-capped Babbler;nigrocapitatum;Frank Lambert;Malaysia;Ulu Mudah, Kedah (nr Earth Lodge);6.1151;100.9634;calls;Pellorneum_capistratum_nigrocapitatum-FL X calls UluMuda Kedah MY 14Nov11 R05_0152.mp3;http://www.xeno-canto.org/sounds/uploaded/YTUXOCTUEM/Pellorneum_capistratum_nigrocapitatum-FL X calls UluMuda Kedah MY 14Nov11 R05_0152.mp3;http://www.xeno-canto.org/sounds/uploaded/YTUXOCTUEM/ffts/tb/Pellorneum_capistratum_nigrocapitatum-FL X calls UluMuda Kedah MY 14Nov11 R05_0152.png
90691;Pellorneum;capistratum;Black-capped Babbler;morrelli;Fabian Ducry  and  David Marques;Malaysia;Poring Hot Springs, Sabah, Borneo;6.0401;116.712;song;20090728_Poring_Black-cappedBabbler_song.mp3;http://www.xeno-canto.org/sounds/uploaded/VLLMNTIBZB/20090728_Poring_Black-cappedBabbler_song.mp3;http://www.xeno-canto.org/sounds/uploaded/VLLMNTIBZB/ffts/tb/20090728_Poring_Black-cappedBabbler_song.png
90726;Pellorneum;capistratum;Black-capped Babbler;;Fabian Ducry  and  David Marques;Indonesia;Carita, West Java;-6.2781;105.8537;song;20090824_Carita_Black-cappedBabbler_song.mp3;http://www.xeno-canto.org/sounds/uploaded/VLLMNTIBZB/20090824_Carita_Black-cappedBabbler_song.mp3;http://www.xeno-canto.org/sounds/uploaded/VLLMNTIBZB/ffts/tb/20090824_Carita_Black-cappedBabbler_song.png
96022;Pellorneum;capistratum;Black-capped Babbler;nigrocapitatum;Frank Lambert;Malaysia;Ulu Mudah, Kedah (nr Earth Lodge);6.1151;100.9634;calls;Pellorneum_capistratum_nigrocapitatum-FL calls UluMuda Kedah MY 14Nov11 R05_0071.mp3;http://www.xeno-canto.org/sounds/uploaded/YTUXOCTUEM/Pellorneum_capistratum_nigrocapitatum-FL calls UluMuda Kedah MY 14Nov11 R05_0071.mp3;http://www.xeno-canto.org/sounds/uploaded/YTUXOCTUEM/ffts/tb/Pellorneum_capistratum_nigrocapitatum-FL calls UluMuda Kedah MY 14Nov11 R05_0071.png
96395;Pellorneum;capistratum;Black-capped Babbler;nigrocapitatum;Frank Lambert;Malaysia;Pahang. Deerland;3.5298;102.1598;song;Pellorneum_capistratum_nigrocapitatum-FL [not seen] Deerland Pahang MY 15Nov09 35m R09_0118.mp3;http://www.xeno-canto.org/sounds/uploaded/YTUXOCTUEM/Pellorneum_capistratum_nigrocapitatum-FL [not seen] Deerland Pahang MY 15Nov09 35m R09_0118.mp3;http://www.xeno-canto.org/sounds/uploaded/YTUXOCTUEM/ffts/tb/Pellorneum_capistratum_nigrocapitatum-FL [not seen] Deerland Pahang MY 15Nov09 35m R09_0118.png
96396;Pellorneum;capistratum;Black-capped Babbler;nigrocapitatum;Frank Lambert;Malaysia;Pahang. Deerland;3.5298;102.1598;song;Pellorneum_capistratum_nigrocapitatum-FL Deerland Pahang MY 15Nov09 35m R09_0121.mp3;http://www.xeno-canto.org/sounds/uploaded/YTUXOCTUEM/Pellorneum_capistratum_nigrocapitatum-FL Deerland Pahang MY 15Nov09 35m R09_0121.mp3;http://www.xeno-canto.org/sounds/uploaded/YTUXOCTUEM/ffts/tb/Pellorneum_capistratum_nigrocapitatum-FL Deerland Pahang MY 15Nov09 35m R09_0121.png
