3083;Polioptila;dumicola;Masked Gnatcatcher;berlepschi;A. Bennett Hennessey;Bolivia;General location in Beni department, Beni;-14.01;-65.01;Song;2368/12.mp3;http://www.xeno-canto.org/sounds/uploaded/GPVWJPVGVN/2368/12.mp3;http://www.xeno-canto.org/sounds/uploaded/GPVWJPVGVN/ffts/tb/2368_12.png
3084;Polioptila;dumicola;Masked Gnatcatcher;berlepschi;A. Bennett Hennessey;Bolivia;General location in Beni department, Beni;-14.01;-65.01;Song. Several types;2368/13a.mp3;http://www.xeno-canto.org/sounds/uploaded/GPVWJPVGVN/2368/13a.mp3;http://www.xeno-canto.org/sounds/uploaded/GPVWJPVGVN/ffts/tb/2368_13a.png
7719;Polioptila;dumicola;Masked Gnatcatcher;;Fernando Jacobs;Brazil;Estância Santa Maria - Jaguarão, Rio Grande do Sul;-32.4545;-53.0964;song;Balanca-rabo-mascarado - Polioptila dumicola01.mp3;http://www.xeno-canto.org/sounds/uploaded/MHHPJBCUXC/Balanca-rabo-mascarado - Polioptila dumicola01.mp3;http://www.xeno-canto.org/sounds/uploaded/MHHPJBCUXC/ffts/tb/Balanca-rabo-mascarado - Polioptila dumicola01.png
7906;Polioptila;dumicola;Masked Gnatcatcher;;Fernando Jacobs;Brazil;Figueiras - Pelotas, Rio Grande do Sul;-31.7184;-52.3276;song;Balanca-rabo-mascarado - Polioptila dumicola02.mp3;http://www.xeno-canto.org/sounds/uploaded/MHHPJBCUXC/Balanca-rabo-mascarado - Polioptila dumicola02.mp3;http://www.xeno-canto.org/sounds/uploaded/MHHPJBCUXC/ffts/tb/Balanca-rabo-mascarado - Polioptila dumicola02.png
8124;Polioptila;dumicola;Masked Gnatcatcher;berlepschi;Bradley Davis;Brazil;Serra dos Caiabis, Alta Floresta - MT;-10.7501;-56.7501;song;BD2006-07-14_Polioptila_dumicola_dumicola.mp3;http://www.xeno-canto.org/sounds/uploaded/YNXJLOESBB/BD2006-07-14_Polioptila_dumicola_dumicola.mp3;http://www.xeno-canto.org/sounds/uploaded/YNXJLOESBB/ffts/tb/BD2006-07-14_Polioptila_dumicola_dumicola.png
8764;Polioptila;dumicola;Masked Gnatcatcher;;Alvaro Riccetto;Uruguay;Campanero, near Minas, Lavalleja;-33.6;-55.06667;song;tacuazul3alvaricc.mp3;http://www.xeno-canto.org/sounds/uploaded/IGDDGNGPAL/tacuazul3alvaricc.mp3;http://www.xeno-canto.org/sounds/uploaded/IGDDGNGPAL/ffts/tb/tacuazul3alvaricc.png
9604;Polioptila;dumicola;Masked Gnatcatcher;;Allen T. Chartier;Brazil;South of Pocone, Mato Grosso;-16.4181;-56.6734;Song, calls;Polioptila_dumicola_BR-Pocone_19931116_S-C1_ATC.mp3;http://www.xeno-canto.org/sounds/uploaded/AZXTZTQJRO/Polioptila_dumicola_BR-Pocone_19931116_S-C1_ATC.mp3;http://www.xeno-canto.org/sounds/uploaded/AZXTZTQJRO/ffts/tb/Polioptila_dumicola_BR-Pocone_19931116_S-C1_ATC.png
10287;Polioptila;dumicola;Masked Gnatcatcher;;Luiz Fernando Figueiredo;Brazil;Rio Aguapeí, SP;;;song;polioptila_dumicola_dourado_lff.mp3;http://www.xeno-canto.org/sounds/uploaded/EYYKGDWADQ/polioptila_dumicola_dourado_lff.mp3;http://www.xeno-canto.org/sounds/uploaded/EYYKGDWADQ/ffts/tb/polioptila_dumicola_dourado_lff.png
14818;Polioptila;dumicola;Masked Gnatcatcher;//;Ricardo Farquharson;Argentina;Palmar Largo, Formosa;-23.1667;-62.01;song;Polioptila dumicola.mp3;http://www.xeno-canto.org/sounds/uploaded/WNTGUYNGRU/Polioptila dumicola.mp3;http://www.xeno-canto.org/sounds/uploaded/WNTGUYNGRU/ffts/tb/Polioptila dumicola.png
15082;Polioptila;dumicola;Masked Gnatcatcher;;Carlos M. Grassini;Argentina;Chajari, Dpto. Federacion, Entre Rios;-30.7987;-57.9706;song;Polyoptila15072002esqlagcChajari.mp3;http://www.xeno-canto.org/sounds/uploaded/NVGJVYZOYT/Polyoptila15072002esqlagcChajari.mp3;http://www.xeno-canto.org/sounds/uploaded/NVGJVYZOYT/ffts/tb/Polyoptila15072002esqlagcChajari.png
15675;Polioptila;dumicola;Masked Gnatcatcher;;Paul Smith;Paraguay;PN Tte Enciso, Dpto Boquerón;-21.08083;-61.61556;calls;Polioptila dumicola song lag cap 2 Oct 07 filt.mp3;http://www.xeno-canto.org/sounds/uploaded/QEQQOPLWSO/Polioptila dumicola song lag cap 2 Oct 07 filt.mp3;http://www.xeno-canto.org/sounds/uploaded/QEQQOPLWSO/ffts/tb/Polioptila dumicola song lag cap 2 Oct 07 filt.png
15676;Polioptila;dumicola;Masked Gnatcatcher;;Paul Smith;Paraguay;PN Tte Enciso, Dpto Boquerón;-21.08083;-61.61556;song;Polioptila dumicolafilt.mp3;http://www.xeno-canto.org/sounds/uploaded/QEQQOPLWSO/Polioptila dumicolafilt.mp3;http://www.xeno-canto.org/sounds/uploaded/QEQQOPLWSO/ffts/tb/Polioptila dumicolafilt.png
20919;Polioptila;dumicola;Masked Gnatcatcher;;Tomas Sigrist;Brazil;Fazenda Fartura, Municipio de Santana do Araguaia, Pará;-9.29722;-50.10194;song;Polioptila dumicola.mp3;http://www.xeno-canto.org/sounds/uploaded/TYZXSONMRC/Polioptila dumicola.mp3;http://www.xeno-canto.org/sounds/uploaded/TYZXSONMRC/ffts/tb/Polioptila dumicola.png
21643;Polioptila;dumicola;Masked Gnatcatcher;;Fernando Jacobs;Brazil;Reserva Biológica do Mato Grande - Arroio Grande, Rio Grande do Sul;-32.1503;-52.7364;song;670202 Polioptila dumicola.mp3;http://www.xeno-canto.org/sounds/uploaded/MHHPJBCUXC/670202 Polioptila dumicola.mp3;http://www.xeno-canto.org/sounds/uploaded/MHHPJBCUXC/ffts/tb/670202 Polioptila dumicola.png
28456;Polioptila;dumicola;Masked Gnatcatcher;;Advaldo D. Prado;Brazil;Dianópolis, Tocantins State;-11.6278;-46.8206;Song;Polioptilia-dumicola-ADP.mp3;http://www.xeno-canto.org/sounds/uploaded/LUMSAVGFDA/Polioptilia-dumicola-ADP.mp3;http://www.xeno-canto.org/sounds/uploaded/LUMSAVGFDA/ffts/tb/Polioptilia-dumicola-ADP.png
31072;Polioptila;dumicola;Masked Gnatcatcher;;Adrian Eisen Rupp;Brazil;Distrito Itaí, Ijuí, Rio Grande do Sul;-28.3298;-53.9992;song;Polioptila dumicola_Distrito Itai_Ijui_RS_19-IX-2008.mp3;http://www.xeno-canto.org/sounds/uploaded/AOPMSCIDIA/Polioptila dumicola_Distrito Itai_Ijui_RS_19-IX-2008.mp3;http://www.xeno-canto.org/sounds/uploaded/AOPMSCIDIA/ffts/tb/Polioptila dumicola_Distrito Itai_Ijui_RS_19-IX-2008.png
34597;Polioptila;dumicola;Masked Gnatcatcher;berlepschi?;Nick Athanas;Brazil;Pousada Caiman, Miranda, MS;-19.9501;-56.3167;calls;HI-0719-Masked-Gnatcatcher.mp3;http://www.xeno-canto.org/sounds/uploaded/XRABICUARW/HI-0719-Masked-Gnatcatcher.mp3;http://www.xeno-canto.org/sounds/uploaded/XRABICUARW/ffts/tb/HI-0719-Masked-Gnatcatcher.png
37211;Polioptila;dumicola;Masked Gnatcatcher;;Eduardo Patrial;Brazil;Emas National Park, Goias state;-18.098866;-52.874451;song;Polioptila_dumicola_(Masked_Gnatcatcher)e.p.11.07.09.mp3;http://www.xeno-canto.org/sounds/uploaded/QEFRRVCRRP/Polioptila_dumicola_(Masked_Gnatcatcher)e.p.11.07.09.mp3;http://www.xeno-canto.org/sounds/uploaded/QEFRRVCRRP/ffts/tb/Polioptila_dumicola_(Masked_Gnatcatcher)e.p.11.07.09.png
37334;Polioptila;dumicola;Masked Gnatcatcher;;Nunes D´Acosta;Brazil;Leopoldo de Bulhões - Goiás;-16.615631;-48.740501;?;dominicula.mp3;http://www.xeno-canto.org/sounds/uploaded/OHHTDSDNBT/dominicula.mp3;http://www.xeno-canto.org/sounds/uploaded/OHHTDSDNBT/ffts/tb/dominicula.png
39940;Polioptila;dumicola;Masked Gnatcatcher;;Alexande V. Grose;Brazil;Praia do Capri - São Francisco do Sul - SC;-26.185596;-48.571844;;GroseSFS2162.22_10_2009.mp3;http://www.xeno-canto.org/sounds/uploaded/ULPCWFNEMN/GroseSFS2162.22_10_2009.mp3;http://www.xeno-canto.org/sounds/uploaded/ULPCWFNEMN/ffts/tb/GroseSFS2162.22_10_2009.png
45182;Polioptila;dumicola;Masked Gnatcatcher;;Ricardo Gagliardi;Brazil;Turmalina, SP;-20.052;-50.4548;call and song;Polioptila_dumicola_SP_091227-0845.mp3;http://www.xeno-canto.org/sounds/uploaded/YRDADNREOP/Polioptila_dumicola_SP_091227-0845.mp3;http://www.xeno-canto.org/sounds/uploaded/YRDADNREOP/ffts/tb/Polioptila_dumicola_SP_091227-0845.png
46924;Polioptila;dumicola;Masked Gnatcatcher;dumicola;Bernabe Lopez-Lanus;Argentina;Estancia El Potrero (La Zanja), Gualeguaychu, Entre Rios;;;Song;Polioptila dumicola_Masked Gnatcatcher_Estancia El Potrero (La Zanja)_Gualeguaychu_Entre Rios_Argentina_2008 a_Bernabe Lopez-Lanus.mp3;http://www.xeno-canto.org/sounds/uploaded/BYLLSJRVDZ/Polioptila dumicola_Masked Gnatcatcher_Estancia El Potrero (La Zanja)_Gualeguaychu_Entre Rios_Argentina_2008 a_Bernabe Lopez-Lanus.mp3;http://www.xeno-canto.org/sounds/uploaded/BYLLSJRVDZ/ffts/tb/Polioptila dumicola_Masked Gnatcatcher_Estancia El Potrero (La Zanja)_Gualeguaychu_Entre Rios_Argentina_2008 a_Bernabe Lopez-Lanus.png
46925;Polioptila;dumicola;Masked Gnatcatcher;dumicola;Bernabe Lopez-Lanus;Argentina;Estancia El Potrero (La Zanja), Gualeguaychu, Entre Rios;;;Song  and  calls;Polioptila dumicola_Masked Gnatcatcher_Estancia El Potrero (La Zanja)_Gualeguaychu_Entre Rios_Argentina_2008 b_Bernabe Lopez-Lanus.mp3;http://www.xeno-canto.org/sounds/uploaded/BYLLSJRVDZ/Polioptila dumicola_Masked Gnatcatcher_Estancia El Potrero (La Zanja)_Gualeguaychu_Entre Rios_Argentina_2008 b_Bernabe Lopez-Lanus.mp3;http://www.xeno-canto.org/sounds/uploaded/BYLLSJRVDZ/ffts/tb/Polioptila dumicola_Masked Gnatcatcher_Estancia El Potrero (La Zanja)_Gualeguaychu_Entre Rios_Argentina_2008 b_Bernabe Lopez-Lanus.png
49444;Polioptila;dumicola;Masked Gnatcatcher;;Rosendo Fraga;Argentina;Lobos, Buenos Aires;;;song;GNATCATCHER Masked_03_Estancia La Candelaria_Lobos_Buenos Aires_AR_13OCT79_Rosendo Fraga.mp3;http://www.xeno-canto.org/sounds/uploaded/JQSYKZHEMB/GNATCATCHER Masked_03_Estancia La Candelaria_Lobos_Buenos Aires_AR_13OCT79_Rosendo Fraga.mp3;http://www.xeno-canto.org/sounds/uploaded/JQSYKZHEMB/ffts/tb/GNATCATCHER Masked_03_Estancia La Candelaria_Lobos_Buenos Aires_AR_13OCT79_Rosendo Fraga.png
49445;Polioptila;dumicola;Masked Gnatcatcher;;Rosendo Fraga;Paraguay;Cauce Yacare Sur, Hayes;;;song;GNATCATCHER Masked_12_Cauce Yacare Sur_Hayes_PY_25SEP02_Rosendo Fraga.mp3;http://www.xeno-canto.org/sounds/uploaded/JQSYKZHEMB/GNATCATCHER Masked_12_Cauce Yacare Sur_Hayes_PY_25SEP02_Rosendo Fraga.mp3;http://www.xeno-canto.org/sounds/uploaded/JQSYKZHEMB/ffts/tb/GNATCATCHER Masked_12_Cauce Yacare Sur_Hayes_PY_25SEP02_Rosendo Fraga.png
49446;Polioptila;dumicola;Masked Gnatcatcher;;Rosendo Fraga;Paraguay;Laguna Capitan,, Hayes;;;song;GNATCATCHER Masked_13_Laguna Capitan,_Hayes_PY_21AGO01_Rosendo Fraga.mp3;http://www.xeno-canto.org/sounds/uploaded/JQSYKZHEMB/GNATCATCHER Masked_13_Laguna Capitan,_Hayes_PY_21AGO01_Rosendo Fraga.mp3;http://www.xeno-canto.org/sounds/uploaded/JQSYKZHEMB/ffts/tb/GNATCATCHER Masked_13_Laguna Capitan,_Hayes_PY_21AGO01_Rosendo Fraga.png
49447;Polioptila;dumicola;Masked Gnatcatcher;;Rosendo Fraga;Paraguay;Laguna Capitan, Hayes;;;song;GNATCATCHER Masked_14_Laguna Capitan_Hayes_PY_26SEP03_Rosendo Fraga.mp3;http://www.xeno-canto.org/sounds/uploaded/JQSYKZHEMB/GNATCATCHER Masked_14_Laguna Capitan_Hayes_PY_26SEP03_Rosendo Fraga.mp3;http://www.xeno-canto.org/sounds/uploaded/JQSYKZHEMB/ffts/tb/GNATCATCHER Masked_14_Laguna Capitan_Hayes_PY_26SEP03_Rosendo Fraga.png
49448;Polioptila;dumicola;Masked Gnatcatcher;;Rosendo Fraga;Paraguay;Laguna Capitan,, Hayes;;;song;GNATCATCHER Masked_16_Laguna Capitan,_Hayes_PY_21AGO01_Rosendo Fraga.mp3;http://www.xeno-canto.org/sounds/uploaded/JQSYKZHEMB/GNATCATCHER Masked_16_Laguna Capitan,_Hayes_PY_21AGO01_Rosendo Fraga.mp3;http://www.xeno-canto.org/sounds/uploaded/JQSYKZHEMB/ffts/tb/GNATCATCHER Masked_16_Laguna Capitan,_Hayes_PY_21AGO01_Rosendo Fraga.png
49449;Polioptila;dumicola;Masked Gnatcatcher;;Rosendo Fraga;Argentina;Lobos, Buenos Aires;;;song;GNATCATCHER Masked_25_Estancia La Candelaria_Lobos_Buenos Aires_AR_17MAR79_Rosendo Fraga.mp3;http://www.xeno-canto.org/sounds/uploaded/JQSYKZHEMB/GNATCATCHER Masked_25_Estancia La Candelaria_Lobos_Buenos Aires_AR_17MAR79_Rosendo Fraga.mp3;http://www.xeno-canto.org/sounds/uploaded/JQSYKZHEMB/ffts/tb/GNATCATCHER Masked_25_Estancia La Candelaria_Lobos_Buenos Aires_AR_17MAR79_Rosendo Fraga.png
50190;Polioptila;dumicola;Masked Gnatcatcher;;Miguel Angel Roda;Argentina;Saladillo, Buenos Aires;-35.641952;-59.775238;call;GNATCATCHER Masked_17_Saladillo_Buenos Aires_AR_DIC84_Miguel Angel Roda.mp3;http://www.xeno-canto.org/sounds/uploaded/FKVINBDVIO/GNATCATCHER Masked_17_Saladillo_Buenos Aires_AR_DIC84_Miguel Angel Roda.mp3;http://www.xeno-canto.org/sounds/uploaded/FKVINBDVIO/ffts/tb/GNATCATCHER Masked_17_Saladillo_Buenos Aires_AR_DIC84_Miguel Angel Roda.png
50191;Polioptila;dumicola;Masked Gnatcatcher;;Miguel Angel Roda;Argentina;Saladillo, Buenos Aires;-35.641952;-59.775238;song;GNATCATCHER Masked_18_Saladillo_Buenos Aires_AR_DIC85_Miguel Angel Roda.mp3;http://www.xeno-canto.org/sounds/uploaded/FKVINBDVIO/GNATCATCHER Masked_18_Saladillo_Buenos Aires_AR_DIC85_Miguel Angel Roda.mp3;http://www.xeno-canto.org/sounds/uploaded/FKVINBDVIO/ffts/tb/GNATCATCHER Masked_18_Saladillo_Buenos Aires_AR_DIC85_Miguel Angel Roda.png
50192;Polioptila;dumicola;Masked Gnatcatcher;;Miguel Angel Roda;Argentina;Saladillo, Buenos Aires;-35.641952;-59.775238;song;GNATCATCHER Masked_19_Saladillo_Buenos Aires_AR_DIC84_Miguel Angel Roda.mp3;http://www.xeno-canto.org/sounds/uploaded/FKVINBDVIO/GNATCATCHER Masked_19_Saladillo_Buenos Aires_AR_DIC84_Miguel Angel Roda.mp3;http://www.xeno-canto.org/sounds/uploaded/FKVINBDVIO/ffts/tb/GNATCATCHER Masked_19_Saladillo_Buenos Aires_AR_DIC84_Miguel Angel Roda.png
50193;Polioptila;dumicola;Masked Gnatcatcher;;Miguel Angel Roda;Argentina;Saladillo, Buenos Aires;-35.641952;-59.775238;call;GNATCATCHER Masked_26_Saladillo_Buenos Aires_AR_1995_Miguel Angel Roda.mp3;http://www.xeno-canto.org/sounds/uploaded/FKVINBDVIO/GNATCATCHER Masked_26_Saladillo_Buenos Aires_AR_1995_Miguel Angel Roda.mp3;http://www.xeno-canto.org/sounds/uploaded/FKVINBDVIO/ffts/tb/GNATCATCHER Masked_26_Saladillo_Buenos Aires_AR_1995_Miguel Angel Roda.png
51108;Polioptila;dumicola;Masked Gnatcatcher;;Bernabe Lopez-Lanus;Argentina;Perdices, Gualeguaychu, Entre Rios;-33.304995;-58.712997;song;GNATCATCHER Masked_01_Perdices_Gualeguaychu_Entre Rios_AR_3NOV01_Bernabe Lopez-Lanus.mp3;http://www.xeno-canto.org/sounds/uploaded/BYLLSJRVDZ/GNATCATCHER Masked_01_Perdices_Gualeguaychu_Entre Rios_AR_3NOV01_Bernabe Lopez-Lanus.mp3;http://www.xeno-canto.org/sounds/uploaded/BYLLSJRVDZ/ffts/tb/GNATCATCHER Masked_01_Perdices_Gualeguaychu_Entre Rios_AR_3NOV01_Bernabe Lopez-Lanus.png
51109;Polioptila;dumicola;Masked Gnatcatcher;;Bernabe Lopez-Lanus;Argentina;Acambuco, Tartagal, Salta;-22.193127;-63.94455;song;GNATCATCHER Masked_08_Acambuco_Salta_AR_5OCT05_Diego Monteleone (Lopez-Lanus et al 2007).mp3;http://www.xeno-canto.org/sounds/uploaded/BYLLSJRVDZ/GNATCATCHER Masked_08_Acambuco_Salta_AR_5OCT05_Diego Monteleone (Lopez-Lanus et al 2007).mp3;http://www.xeno-canto.org/sounds/uploaded/BYLLSJRVDZ/ffts/tb/GNATCATCHER Masked_08_Acambuco_Salta_AR_5OCT05_Diego Monteleone (Lopez-Lanus et al 2007).png
51110;Polioptila;dumicola;Masked Gnatcatcher;;Bernabe Lopez-Lanus;Argentina;Acambuco, Tartagal, Salta;-22.193127;-63.94455;song;GNATCATCHER Masked_09_Acambuco_Salta_AR_5OCT05_Diego Monteleone (Lopez-Lanus et al 2007).mp3;http://www.xeno-canto.org/sounds/uploaded/BYLLSJRVDZ/GNATCATCHER Masked_09_Acambuco_Salta_AR_5OCT05_Diego Monteleone (Lopez-Lanus et al 2007).mp3;http://www.xeno-canto.org/sounds/uploaded/BYLLSJRVDZ/ffts/tb/GNATCATCHER Masked_09_Acambuco_Salta_AR_5OCT05_Diego Monteleone (Lopez-Lanus et al 2007).png
51111;Polioptila;dumicola;Masked Gnatcatcher;;Bernabe Lopez-Lanus;Argentina;Acambuco, Tartagal, Salta;-22.193127;-63.94455;song;GNATCATCHER Masked_23_Acambuco_Salta_AR_28MAR05_rpb_B Lopez-Lanus  (BLL et al 2007).mp3;http://www.xeno-canto.org/sounds/uploaded/BYLLSJRVDZ/GNATCATCHER Masked_23_Acambuco_Salta_AR_28MAR05_rpb_B Lopez-Lanus  (BLL et al 2007).mp3;http://www.xeno-canto.org/sounds/uploaded/BYLLSJRVDZ/ffts/tb/GNATCATCHER Masked_23_Acambuco_Salta_AR_28MAR05_rpb_B Lopez-Lanus  (BLL et al 2007).png
52877;Polioptila;dumicola;Masked Gnatcatcher;;Carlos Ferrari;Argentina;Reserva Costanera Sur, Buenos Aires;;;song;GNATCATCHER Masked_04_Reserva Costanera Sur_Buenos Aires_AR_JUL04_Carlos Ferrari.mp3;http://www.xeno-canto.org/sounds/uploaded/ZYWOYHEPUK/GNATCATCHER Masked_04_Reserva Costanera Sur_Buenos Aires_AR_JUL04_Carlos Ferrari.mp3;http://www.xeno-canto.org/sounds/uploaded/ZYWOYHEPUK/ffts/tb/GNATCATCHER Masked_04_Reserva Costanera Sur_Buenos Aires_AR_JUL04_Carlos Ferrari.png
52878;Polioptila;dumicola;Masked Gnatcatcher;;Carlos Ferrari;Argentina;Reserva Costanera Sur, Buenos Aires;;;song;GNATCATCHER Masked_20_Reserva Costanera Sur_Buenos Aires_AR_ENE04_female_Carlos Ferrari.mp3;http://www.xeno-canto.org/sounds/uploaded/ZYWOYHEPUK/GNATCATCHER Masked_20_Reserva Costanera Sur_Buenos Aires_AR_ENE04_female_Carlos Ferrari.mp3;http://www.xeno-canto.org/sounds/uploaded/ZYWOYHEPUK/ffts/tb/GNATCATCHER Masked_20_Reserva Costanera Sur_Buenos Aires_AR_ENE04_female_Carlos Ferrari.png
52879;Polioptila;dumicola;Masked Gnatcatcher;;Carlos Ferrari;Argentina;Reserva Costanera Sur, Buenos Aires;;;call;GNATCATCHER Masked_22_Reserva Costanera Sur_Buenos Aires_AR_ENE04_Carlos Ferrari.mp3;http://www.xeno-canto.org/sounds/uploaded/ZYWOYHEPUK/GNATCATCHER Masked_22_Reserva Costanera Sur_Buenos Aires_AR_ENE04_Carlos Ferrari.mp3;http://www.xeno-canto.org/sounds/uploaded/ZYWOYHEPUK/ffts/tb/GNATCATCHER Masked_22_Reserva Costanera Sur_Buenos Aires_AR_ENE04_Carlos Ferrari.png
52880;Polioptila;dumicola;Masked Gnatcatcher;;Carlos Ferrari;Argentina;Reserva Costanera Sur, Buenos Aires;;;call;GNATCATCHER Masked_24_Reserva Costanera Sur_Buenos Aires_AR_ENE04_Carlos Ferrari.mp3;http://www.xeno-canto.org/sounds/uploaded/ZYWOYHEPUK/GNATCATCHER Masked_24_Reserva Costanera Sur_Buenos Aires_AR_ENE04_Carlos Ferrari.mp3;http://www.xeno-canto.org/sounds/uploaded/ZYWOYHEPUK/ffts/tb/GNATCATCHER Masked_24_Reserva Costanera Sur_Buenos Aires_AR_ENE04_Carlos Ferrari.png
54075;Polioptila;dumicola;Masked Gnatcatcher;;Fabricio Gorleri;Argentina;PN Pre-Delta, La Jaula, Entre Rios;;;song;GNATCATCHER Masked_02_PN Pre-Delta_La Jaula_Entre Rios_AR_4NOV06_Fabricio Gorleri.mp3;http://www.xeno-canto.org/sounds/uploaded/BOLWZYKUPY/GNATCATCHER Masked_02_PN Pre-Delta_La Jaula_Entre Rios_AR_4NOV06_Fabricio Gorleri.mp3;http://www.xeno-canto.org/sounds/uploaded/BOLWZYKUPY/ffts/tb/GNATCATCHER Masked_02_PN Pre-Delta_La Jaula_Entre Rios_AR_4NOV06_Fabricio Gorleri.png
60478;Polioptila;dumicola;Masked Gnatcatcher;;Miguel Castelino;Argentina;Estancia Puerto Valle, Ituzaingo, Corrientes;;;song;GNATCATCHER Masked_06_Estancia Puerto Valle_Ituzaingo_Corrientes_AR_3SEP89_Miguel Castelino.mp3;http://www.xeno-canto.org/sounds/uploaded/RCJCABZSNP/GNATCATCHER Masked_06_Estancia Puerto Valle_Ituzaingo_Corrientes_AR_3SEP89_Miguel Castelino.mp3;http://www.xeno-canto.org/sounds/uploaded/RCJCABZSNP/ffts/tb/GNATCATCHER Masked_06_Estancia Puerto Valle_Ituzaingo_Corrientes_AR_3SEP89_Miguel Castelino.png
61222;Polioptila;dumicola;Masked Gnatcatcher;;Bernabe Lopez-Lanus;Argentina;Campo Avalos, Estancia San Pedro-rio Uruguay, Monte Caseros, Corrientes;;;Song;2627 Polioptila dumicola_Campo Avalos_Estancia San Pedro-rio Uruguay_Monte Caseros_Corrientes_Arg_18AGO2010_B Lopez-Lanus.mp3;http://www.xeno-canto.org/sounds/uploaded/BYLLSJRVDZ/2627 Polioptila dumicola_Campo Avalos_Estancia San Pedro-rio Uruguay_Monte Caseros_Corrientes_Arg_18AGO2010_B Lopez-Lanus.mp3;http://www.xeno-canto.org/sounds/uploaded/BYLLSJRVDZ/ffts/tb/2627 Polioptila dumicola_Campo Avalos_Estancia San Pedro-rio Uruguay_Monte Caseros_Corrientes_Arg_18AGO2010_B Lopez-Lanus.png
63926;Polioptila;dumicola;Masked Gnatcatcher;;Joseph Tobias and Nathalie Seddon;Bolivia;Tambo;;;call;Polidumi01.mp3;http://www.xeno-canto.org/sounds/uploaded/IKMWQIXRNV/Polidumi01.mp3;http://www.xeno-canto.org/sounds/uploaded/IKMWQIXRNV/ffts/tb/Polidumi01.png
75674;Polioptila;dumicola;Masked Gnatcatcher;berlepschi;Daniel Lane;Brazil;S Pocone on Transpantaneira, Mato Grosso;-16.581;-56.745;female song?;Polioptila dumicola110221_T581.mp3;http://www.xeno-canto.org/sounds/uploaded/WOEAFQRMUD/Polioptila dumicola110221_T581.mp3;http://www.xeno-canto.org/sounds/uploaded/WOEAFQRMUD/ffts/tb/Polioptila dumicola110221_T581.png
82189;Polioptila;dumicola;Masked Gnatcatcher;dumicola;Jeremy Minns;Brazil;Barra do Quaraí;-30.1834;-57.4501;Song;CRAPYR05.mp3;http://www.xeno-canto.org/sounds/uploaded/DGVLLRYDXS/CRAPYR05.mp3;http://www.xeno-canto.org/sounds/uploaded/DGVLLRYDXS/ffts/tb/CRAPYR05.png
82356;Polioptila;dumicola;Masked Gnatcatcher;berlepschi;Jeremy Minns;Brazil;Pirenópolis, GO;-15.8667;-48.9501;Call;POLDUM08.mp3;http://www.xeno-canto.org/sounds/uploaded/DGVLLRYDXS/POLDUM08.mp3;http://www.xeno-canto.org/sounds/uploaded/DGVLLRYDXS/ffts/tb/POLDUM08.png
82357;Polioptila;dumicola;Masked Gnatcatcher;dumicola;Jeremy Minns;Brazil;Aquidauana;-20.4834;-55.8167;Song;POLDUM09.mp3;http://www.xeno-canto.org/sounds/uploaded/DGVLLRYDXS/POLDUM09.mp3;http://www.xeno-canto.org/sounds/uploaded/DGVLLRYDXS/ffts/tb/POLDUM09.png
82358;Polioptila;dumicola;Masked Gnatcatcher;dumicola;Jeremy Minns;Brazil;Passo do Lontra, Pantanal de Miranda, MS;-19.26667;-57.01667;Song and calls;POLDUM10.mp3;http://www.xeno-canto.org/sounds/uploaded/DGVLLRYDXS/POLDUM10.mp3;http://www.xeno-canto.org/sounds/uploaded/DGVLLRYDXS/ffts/tb/POLDUM10.png
82359;Polioptila;dumicola;Masked Gnatcatcher;berlepschi;Jeremy Minns;Brazil;Transpantaneira south of Pixaim, MT;-16.8248;-56.8448;Song;POLDUM11.mp3;http://www.xeno-canto.org/sounds/uploaded/DGVLLRYDXS/POLDUM11.mp3;http://www.xeno-canto.org/sounds/uploaded/DGVLLRYDXS/ffts/tb/POLDUM11.png
82360;Polioptila;dumicola;Masked Gnatcatcher;berlepschi;Jeremy Minns;Brazil;Transpantaneira south of Pixaim, MT;-16.8248;-56.8448;Song;POLDUM12.mp3;http://www.xeno-canto.org/sounds/uploaded/DGVLLRYDXS/POLDUM12.mp3;http://www.xeno-canto.org/sounds/uploaded/DGVLLRYDXS/ffts/tb/POLDUM12.png
82361;Polioptila;dumicola;Masked Gnatcatcher;dumicola;Jeremy Minns;Brazil;Barra do Quaraí;-30.1834;-57.4501;Song;POLDUM24.mp3;http://www.xeno-canto.org/sounds/uploaded/DGVLLRYDXS/POLDUM24.mp3;http://www.xeno-canto.org/sounds/uploaded/DGVLLRYDXS/ffts/tb/POLDUM24.png
82362;Polioptila;dumicola;Masked Gnatcatcher;dumicola;Jeremy Minns;Brazil;Barra do Quaraí;-30.1834;-57.4501;Calls;POLDUM25.mp3;http://www.xeno-canto.org/sounds/uploaded/DGVLLRYDXS/POLDUM25.mp3;http://www.xeno-canto.org/sounds/uploaded/DGVLLRYDXS/ffts/tb/POLDUM25.png
83335;Polioptila;dumicola;Masked Gnatcatcher;;Fernando Fávaro;Brazil;1Brasília National Park, Brasília/DF.;-15.6626;-48.017;Song;FLF_Polioptila_dumicola.mp3;http://www.xeno-canto.org/sounds/uploaded/QTNGUZTTQM/FLF_Polioptila_dumicola.mp3;http://www.xeno-canto.org/sounds/uploaded/QTNGUZTTQM/ffts/tb/FLF_Polioptila_dumicola.png
85933;Polioptila;dumicola;Masked Gnatcatcher;;Rafael Antunes Dias;Brazil;Banhado do Maçarico, Rio Grande, Rio Grande do Sul;-32.316;-52.422;song and call;Polioptila_dumicola_rafael_dias_05_aug_2011_.mp3;http://www.xeno-canto.org/sounds/uploaded/XJSWEWQCEC/Polioptila_dumicola_rafael_dias_05_aug_2011_.mp3;http://www.xeno-canto.org/sounds/uploaded/XJSWEWQCEC/ffts/tb/Polioptila_dumicola_rafael_dias_05_aug_2011_.png
86054;Polioptila;dumicola;Masked Gnatcatcher;;Rafael Antunes Dias;Brazil;Banhado do Maçarico, Rio Grande, Rio Grande do Sul;-32.316;-52.422;song;Polioptila_dumicola_song_1_rafael_dias_14_aug_2011_.mp3;http://www.xeno-canto.org/sounds/uploaded/XJSWEWQCEC/Polioptila_dumicola_song_1_rafael_dias_14_aug_2011_.mp3;http://www.xeno-canto.org/sounds/uploaded/XJSWEWQCEC/ffts/tb/Polioptila_dumicola_song_1_rafael_dias_14_aug_2011_.png
86055;Polioptila;dumicola;Masked Gnatcatcher;;Rafael Antunes Dias;Brazil;Banhado do Maçarico, Rio Grande, Rio Grande do Sul;-32.316;-52.422;song;Polioptila_dumicola_song_2_rafael_dias_14_aug_2011_.mp3;http://www.xeno-canto.org/sounds/uploaded/XJSWEWQCEC/Polioptila_dumicola_song_2_rafael_dias_14_aug_2011_.mp3;http://www.xeno-canto.org/sounds/uploaded/XJSWEWQCEC/ffts/tb/Polioptila_dumicola_song_2_rafael_dias_14_aug_2011_.png
90779;Polioptila;dumicola;Masked Gnatcatcher;;Marcos Melo;Brazil;urban area, Cuiaba, Mato Grosso state;-15.605;-56.077;call;MZ019Polioptila_dumicola_cuiaba_MMelo.mp3;http://www.xeno-canto.org/sounds/uploaded/MRGDYNJGUJ/MZ019Polioptila_dumicola_cuiaba_MMelo.mp3;http://www.xeno-canto.org/sounds/uploaded/MRGDYNJGUJ/ffts/tb/MZ019Polioptila_dumicola_cuiaba_MMelo.png
90780;Polioptila;dumicola;Masked Gnatcatcher;;Marcos Melo;Brazil;urban area, Cuiaba, Mato Grosso state;-15.605;-56.077;call;Mz21Polioptila_dumicola_c2_cuiaba_mmelo.mp3;http://www.xeno-canto.org/sounds/uploaded/MRGDYNJGUJ/Mz21Polioptila_dumicola_c2_cuiaba_mmelo.mp3;http://www.xeno-canto.org/sounds/uploaded/MRGDYNJGUJ/ffts/tb/Mz21Polioptila_dumicola_c2_cuiaba_mmelo.png
90781;Polioptila;dumicola;Masked Gnatcatcher;;Marcos Melo;Brazil;urban area, Cuiaba, Mato Grosso state;-15.605;-56.077;call;MZ22Polioptila_dumicola_c3_cuiaba_MMelo.mp3;http://www.xeno-canto.org/sounds/uploaded/MRGDYNJGUJ/MZ22Polioptila_dumicola_c3_cuiaba_MMelo.mp3;http://www.xeno-canto.org/sounds/uploaded/MRGDYNJGUJ/ffts/tb/MZ22Polioptila_dumicola_c3_cuiaba_MMelo.png
90782;Polioptila;dumicola;Masked Gnatcatcher;;Marcos Melo;Brazil;urban area, Cuiaba, Mato Grosso state;-15.605;-56.077;call;MZ23Polioptila_dumicola_cuiaba_c4_MMelo.mp3;http://www.xeno-canto.org/sounds/uploaded/MRGDYNJGUJ/MZ23Polioptila_dumicola_cuiaba_c4_MMelo.mp3;http://www.xeno-canto.org/sounds/uploaded/MRGDYNJGUJ/ffts/tb/MZ23Polioptila_dumicola_cuiaba_c4_MMelo.png
