1069;Ramphocelus;carbo;Silver-beaked Tanager;;Jan-Hein Ribot;Suriname;Mapane;5.3901;-54.7401;song;raca.mp3;http://www.xeno-canto.org/sounds/uploaded/EOVSIPQAGB/raca.mp3;http://www.xeno-canto.org/sounds/uploaded/EOVSIPQAGB/ffts/tb/raca.png
8326;Ramphocelus;carbo;Silver-beaked Tanager;;Herman van Oosten;Peru;Imazita, Amazonas;;;dawn song;RhamphocCarbo_dawnsong_Imazita19906300.mp3;http://www.xeno-canto.org/sounds/uploaded/SNUDCZVUQK/RhamphocCarbo_dawnsong_Imazita19906300.mp3;http://www.xeno-canto.org/sounds/uploaded/SNUDCZVUQK/ffts/tb/RhamphocCarbo_dawnsong_Imazita19906300.png
2571;Ramphocelus;carbo;Silver-beaked Tanager;;Sjoerd Mayer;Bolivia;Sajta, Cochabamba;-17.1;-64.75;Calls. Song;73/b12.mp3;http://www.xeno-canto.org/sounds/uploaded/KOIEAHGHNX/73/b12.mp3;http://www.xeno-canto.org/sounds/uploaded/KOIEAHGHNX/ffts/tb/73_b12.png
3749;Ramphocelus;carbo;Silver-beaked Tanager;;Sebastian K. Herzog;Bolivia;Río Macuñucú, Amboró NP, Santa Cruz;-17.7334;-63.6001;Song;2088/a28.mp3;http://www.xeno-canto.org/sounds/uploaded/UYGLRGKDEF/2088/a28.mp3;http://www.xeno-canto.org/sounds/uploaded/UYGLRGKDEF/ffts/tb/2088_a28.png
7658;Ramphocelus;carbo;Silver-beaked Tanager;;Otte Ottema;Suriname;Bakhuys mountains;4.7301;-56.7701;calls?;Otot-RamCar.mp3;http://www.xeno-canto.org/sounds/uploaded/ASEUAUOXZA/Otot-RamCar.mp3;http://www.xeno-canto.org/sounds/uploaded/ASEUAUOXZA/ffts/tb/Otot-RamCar.png
8722;Ramphocelus;carbo;Silver-beaked Tanager;carbo;Nick Athanas;Brazil;5km north of Pres. Figueiredo, AM;-2.0167;-60.0334;dawn song;016-046-Silver-beaked-Tanager.mp3;http://www.xeno-canto.org/sounds/uploaded/XRABICUARW/016-046-Silver-beaked-Tanager.mp3;http://www.xeno-canto.org/sounds/uploaded/XRABICUARW/ffts/tb/016-046-Silver-beaked-Tanager.png
14901;Ramphocelus;carbo;Silver-beaked Tanager;;Bradley Davis;Brazil;Pousada Rio Azul, PA;-9.2456;-55.987;dawn song;BD_2007-07-31_Ramphocelus_carboXC.mp3;http://www.xeno-canto.org/sounds/uploaded/YNXJLOESBB/BD_2007-07-31_Ramphocelus_carboXC.mp3;http://www.xeno-canto.org/sounds/uploaded/YNXJLOESBB/ffts/tb/BD_2007-07-31_Ramphocelus_carboXC.png
19995;Ramphocelus;carbo;Silver-beaked Tanager;;Charlie Vogt;Ecuador;Copalinga Lodge, Zamora-Chinchipe;-4.094411;-78.95462;dawn song;Silver-beaked Tanager dawn song R096_0148.mp3;http://www.xeno-canto.org/sounds/uploaded/NYTXYAQSTH/Silver-beaked Tanager dawn song R096_0148.mp3;http://www.xeno-canto.org/sounds/uploaded/NYTXYAQSTH/ffts/tb/Silver-beaked Tanager dawn song R096_0148.png
37981;Ramphocelus;carbo;Silver-beaked Tanager;;Oswaldo Cortes;Colombia;Municipio de Pandi (cundinamarca)_4° 11' 39'' N, 74°29' 26'';4.1942;-74.4906;Songs;ramphocerlus carbo1203698.mp3;http://www.xeno-canto.org/sounds/uploaded/VVDRVZCVWW/ramphocerlus carbo1203698.mp3;http://www.xeno-canto.org/sounds/uploaded/VVDRVZCVWW/ffts/tb/ramphocerlus carbo1203698.png
38844;Ramphocelus;carbo;Silver-beaked Tanager;;Oswaldo Cortes;Colombia;FARALLON DE MEDINA;4.5834;-73.4834;Songs;Ramphocelus carbo125874.mp3;http://www.xeno-canto.org/sounds/uploaded/VVDRVZCVWW/Ramphocelus carbo125874.mp3;http://www.xeno-canto.org/sounds/uploaded/VVDRVZCVWW/ffts/tb/Ramphocelus carbo125874.png
44435;Ramphocelus;carbo;Silver-beaked Tanager;;Thomas Donegan;Bolivia;Urpuma, Sandillani, PNN Cotapata, La Paz;-16.2223;-67.8762;Calls;Disc 11 Track 73 Ramphocelus carbo call.mp3;http://www.xeno-canto.org/sounds/uploaded/OXSIOLJJUP/Disc 11 Track 73 Ramphocelus carbo call.mp3;http://www.xeno-canto.org/sounds/uploaded/OXSIOLJJUP/ffts/tb/Disc 11 Track 73 Ramphocelus carbo call.png
49956;Ramphocelus;carbo;Silver-beaked Tanager;;Rosendo Fraga;Bolivia;BuenaVista, Santa Cruz;;;song;TANAGER Silver-beaked_01_BuenaVista_Santa Cruz_BO_10OCT98_Rosendo Fraga.mp3;http://www.xeno-canto.org/sounds/uploaded/JQSYKZHEMB/TANAGER Silver-beaked_01_BuenaVista_Santa Cruz_BO_10OCT98_Rosendo Fraga.mp3;http://www.xeno-canto.org/sounds/uploaded/JQSYKZHEMB/ffts/tb/TANAGER Silver-beaked_01_BuenaVista_Santa Cruz_BO_10OCT98_Rosendo Fraga.png
49957;Ramphocelus;carbo;Silver-beaked Tanager;;Rosendo Fraga;Bolivia;BuenaVista, Santa Cruz;;;song;TANAGER Silver-beaked_02_BuenaVista_Santa Cruz_BO_10OCT98_Rosendo Fraga.mp3;http://www.xeno-canto.org/sounds/uploaded/JQSYKZHEMB/TANAGER Silver-beaked_02_BuenaVista_Santa Cruz_BO_10OCT98_Rosendo Fraga.mp3;http://www.xeno-canto.org/sounds/uploaded/JQSYKZHEMB/ffts/tb/TANAGER Silver-beaked_02_BuenaVista_Santa Cruz_BO_10OCT98_Rosendo Fraga.png
49958;Ramphocelus;carbo;Silver-beaked Tanager;;Rosendo Fraga;Bolivia;BuenaVista, Santa Cruz;;;song;TANAGER Silver-beaked_04_BuenaVista_Santa Cruz_BO_10OCT98_Rosendo Fraga.mp3;http://www.xeno-canto.org/sounds/uploaded/JQSYKZHEMB/TANAGER Silver-beaked_04_BuenaVista_Santa Cruz_BO_10OCT98_Rosendo Fraga.mp3;http://www.xeno-canto.org/sounds/uploaded/JQSYKZHEMB/ffts/tb/TANAGER Silver-beaked_04_BuenaVista_Santa Cruz_BO_10OCT98_Rosendo Fraga.png
49959;Ramphocelus;carbo;Silver-beaked Tanager;;Rosendo Fraga;Bolivia;BuenaVista, Santa Cruz;;;call;TANAGER Silver-beaked_05_BuenaVista_Santa Cruz_BO_10OCT98_Rosendo Fraga.mp3;http://www.xeno-canto.org/sounds/uploaded/JQSYKZHEMB/TANAGER Silver-beaked_05_BuenaVista_Santa Cruz_BO_10OCT98_Rosendo Fraga.mp3;http://www.xeno-canto.org/sounds/uploaded/JQSYKZHEMB/ffts/tb/TANAGER Silver-beaked_05_BuenaVista_Santa Cruz_BO_10OCT98_Rosendo Fraga.png
52768;Ramphocelus;carbo;Silver-beaked Tanager;;Renan Campos de Oliveira;Brazil;Pantanal do Miranda - MS;-19.5512;-57.012;Calls;Ramphocelus carbo (Miranda MS).mp3;http://www.xeno-canto.org/sounds/uploaded/SDARDTGGWP/Ramphocelus carbo (Miranda MS).mp3;http://www.xeno-canto.org/sounds/uploaded/SDARDTGGWP/ffts/tb/Ramphocelus carbo (Miranda MS).png
54463;Ramphocelus;carbo;Silver-beaked Tanager;;Marcos Melo;Brazil;Aguas da Prata, SP;-21.932;-46.715;calls;Ramphocelus carbo aguas da prata MMelo.mp3;http://www.xeno-canto.org/sounds/uploaded/MRGDYNJGUJ/Ramphocelus carbo aguas da prata MMelo.mp3;http://www.xeno-canto.org/sounds/uploaded/MRGDYNJGUJ/ffts/tb/Ramphocelus carbo aguas da prata MMelo.png
54701;Ramphocelus;carbo;Silver-beaked Tanager;;Bernabe Lopez-Lanus;Colombia;Finca La Pradera, Parroquia Remolinos, Municipio Puerto Lopez, Meta;;;Call;Ramphocelus carbo_Finca La Pradera_Parroquia Remolinos_Municipio Puerto Lopez_Meta_Colombia_17ABR2000 a_Bernabe Lopez-Lanus.mp3;http://www.xeno-canto.org/sounds/uploaded/BYLLSJRVDZ/Ramphocelus carbo_Finca La Pradera_Parroquia Remolinos_Municipio Puerto Lopez_Meta_Colombia_17ABR2000 a_Bernabe Lopez-Lanus.mp3;http://www.xeno-canto.org/sounds/uploaded/BYLLSJRVDZ/ffts/tb/Ramphocelus carbo_Finca La Pradera_Parroquia Remolinos_Municipio Puerto Lopez_Meta_Colombia_17ABR2000 a_Bernabe Lopez-Lanus.png
54812;Ramphocelus;carbo;Silver-beaked Tanager;;Bernabe Lopez-Lanus;Colombia;Finca La Pradera, Parroquia Remolinos, Municipio Puerto Lopez, Meta;;;Call;Ramphocelus carbo_Finca La Pradera_Parroquia Remolinos_Municipio Puerto Lopez_Meta_Colombia_17ABR2000 b_Bernabe Lopez-Lanus.mp3;http://www.xeno-canto.org/sounds/uploaded/BYLLSJRVDZ/Ramphocelus carbo_Finca La Pradera_Parroquia Remolinos_Municipio Puerto Lopez_Meta_Colombia_17ABR2000 b_Bernabe Lopez-Lanus.mp3;http://www.xeno-canto.org/sounds/uploaded/BYLLSJRVDZ/ffts/tb/Ramphocelus carbo_Finca La Pradera_Parroquia Remolinos_Municipio Puerto Lopez_Meta_Colombia_17ABR2000 b_Bernabe Lopez-Lanus.png
56130;Ramphocelus;carbo;Silver-beaked Tanager;;Patrick INGREMEAU;French Guiana;Réserve Trésor - Montagne de Kaw - Roura;;;song;Ramphocelus carbo - Tresor -A  2010-03-11.mp3;http://www.xeno-canto.org/sounds/uploaded/IIVTYSKEYX/Ramphocelus carbo - Tresor -A  2010-03-11.mp3;http://www.xeno-canto.org/sounds/uploaded/IIVTYSKEYX/ffts/tb/Ramphocelus carbo - Tresor -A  2010-03-11.png
58367;Ramphocelus;carbo;Silver-beaked Tanager;;Evair Legal;Brazil;Palmeirante;-7.955;-48.301;call;Thraupidae._Ramphocelus_carbo_Palmeirante-TO_19.07.2010_EL.mp3;http://www.xeno-canto.org/sounds/uploaded/SMJXFKLATM/Thraupidae._Ramphocelus_carbo_Palmeirante-TO_19.07.2010_EL.mp3;http://www.xeno-canto.org/sounds/uploaded/SMJXFKLATM/ffts/tb/Thraupidae._Ramphocelus_carbo_Palmeirante-TO_19.07.2010_EL.png
59811;Ramphocelus;carbo;Silver-beaked Tanager;;Thomas Donegan;Peru;Explorer's Inn, Tambopata;-12.8384;-69.2945;Calls;Disc 13 Track 33 Ramphocelus carbo with Cacicus cela et al.mp3;http://www.xeno-canto.org/sounds/uploaded/OXSIOLJJUP/Disc 13 Track 33 Ramphocelus carbo with Cacicus cela et al.mp3;http://www.xeno-canto.org/sounds/uploaded/OXSIOLJJUP/ffts/tb/Disc 13 Track 33 Ramphocelus carbo with Cacicus cela et al.png
60919;Ramphocelus;carbo;Silver-beaked Tanager;;Miguel Castelino;Brazil;Alta Floresta Lodge, Mato Grosso;;;song;TANAGER Silver-beaked_03_Alta Floresta Lodge_Mato Grosso_BR_21NOV92_Miguel Castelino.mp3;http://www.xeno-canto.org/sounds/uploaded/RCJCABZSNP/TANAGER Silver-beaked_03_Alta Floresta Lodge_Mato Grosso_BR_21NOV92_Miguel Castelino.mp3;http://www.xeno-canto.org/sounds/uploaded/RCJCABZSNP/ffts/tb/TANAGER Silver-beaked_03_Alta Floresta Lodge_Mato Grosso_BR_21NOV92_Miguel Castelino.png
63972;Ramphocelus;carbo;Silver-beaked Tanager;;Joseph Tobias and Nathalie Seddon;Peru;San Pedro (i.e. Cock of the Rock Lodge), Manu Road (1500-1700);-13.0501;-71.5564;song;Rampcarb01.mp3;http://www.xeno-canto.org/sounds/uploaded/IKMWQIXRNV/Rampcarb01.mp3;http://www.xeno-canto.org/sounds/uploaded/IKMWQIXRNV/ffts/tb/Rampcarb01.png
63973;Ramphocelus;carbo;Silver-beaked Tanager;;Joseph Tobias and Nathalie Seddon;Bolivia;Noel Kempff Mercado National Park, Flor de Oro;;;song;Rampcarb02.mp3;http://www.xeno-canto.org/sounds/uploaded/IKMWQIXRNV/Rampcarb02.mp3;http://www.xeno-canto.org/sounds/uploaded/IKMWQIXRNV/ffts/tb/Rampcarb02.png
63974;Ramphocelus;carbo;Silver-beaked Tanager;;Joseph Tobias and Nathalie Seddon;Bolivia;Noel Kempff Mercado National Park, Lago Caiman;;;song;Rampcarb03.mp3;http://www.xeno-canto.org/sounds/uploaded/IKMWQIXRNV/Rampcarb03.mp3;http://www.xeno-canto.org/sounds/uploaded/IKMWQIXRNV/ffts/tb/Rampcarb03.png
66448;Ramphocelus;carbo;Silver-beaked Tanager;;Alexandre Renaudier;French Guiana;Régina;4.31667;-52.1333;call;20100914RAMCAR.mp3;http://www.xeno-canto.org/sounds/uploaded/GKADEITXTH/20100914RAMCAR.mp3;http://www.xeno-canto.org/sounds/uploaded/GKADEITXTH/ffts/tb/20100914RAMCAR.png
66873;Ramphocelus;carbo;Silver-beaked Tanager;;Alexandre Renaudier;French Guiana;Sinnamary, route de St Elie;5.327;-53.103;song;20100910RAMCAR.mp3;http://www.xeno-canto.org/sounds/uploaded/GKADEITXTH/20100910RAMCAR.mp3;http://www.xeno-canto.org/sounds/uploaded/GKADEITXTH/ffts/tb/20100910RAMCAR.png
66982;Ramphocelus;carbo;Silver-beaked Tanager;;Alexandre Renaudier;French Guiana;Roura, auberge des orpailleurs;;;call;20100919RAMCAR.mp3;http://www.xeno-canto.org/sounds/uploaded/GKADEITXTH/20100919RAMCAR.mp3;http://www.xeno-canto.org/sounds/uploaded/GKADEITXTH/ffts/tb/20100919RAMCAR.png
74139;Ramphocelus;carbo;Silver-beaked Tanager;;Joseph Tobias and Nathalie Seddon;Bolivia;CICRA, Madre de Dios, PE;-12.569167;-70.100111;song;Ramphocelus_carbo_T1043.mp3;http://www.xeno-canto.org/sounds/uploaded/IKMWQIXRNV/Ramphocelus_carbo_T1043.mp3;http://www.xeno-canto.org/sounds/uploaded/IKMWQIXRNV/ffts/tb/Ramphocelus_carbo_T1043.png
74140;Ramphocelus;carbo;Silver-beaked Tanager;;Joseph Tobias and Nathalie Seddon;Bolivia;CICRA, Madre de Dios, PE;-12.569167;-70.100111;song;Ramphocelus_carbo_T1044.mp3;http://www.xeno-canto.org/sounds/uploaded/IKMWQIXRNV/Ramphocelus_carbo_T1044.mp3;http://www.xeno-canto.org/sounds/uploaded/IKMWQIXRNV/ffts/tb/Ramphocelus_carbo_T1044.png
74141;Ramphocelus;carbo;Silver-beaked Tanager;;Joseph Tobias and Nathalie Seddon;Bolivia;CICRA, Madre de Dios, PE;-12.569167;-70.100111;call;Ramphocelus_carbo_T980.mp3;http://www.xeno-canto.org/sounds/uploaded/IKMWQIXRNV/Ramphocelus_carbo_T980.mp3;http://www.xeno-canto.org/sounds/uploaded/IKMWQIXRNV/ffts/tb/Ramphocelus_carbo_T980.png
79962;Ramphocelus;carbo;Silver-beaked Tanager;;Patrick INGREMEAU;French Guiana;Saül;3.6167;-53.2001;song;B06h06m34s28oct2010 - Ramphocelus carbo.mp3;http://www.xeno-canto.org/sounds/uploaded/IIVTYSKEYX/B06h06m34s28oct2010 - Ramphocelus carbo.mp3;http://www.xeno-canto.org/sounds/uploaded/IIVTYSKEYX/ffts/tb/B06h06m34s28oct2010 - Ramphocelus carbo.png
79964;Ramphocelus;carbo;Silver-beaked Tanager;;Patrick Ingremeau;French Guiana;Saül;3.6167;-53.2001;song;B17h31m43s27oct2010 - Ramphocelus carbo.mp3;http://www.xeno-canto.org/sounds/uploaded/IIVTYSKEYX/B17h31m43s27oct2010 - Ramphocelus carbo.mp3;http://www.xeno-canto.org/sounds/uploaded/IIVTYSKEYX/ffts/tb/B17h31m43s27oct2010 - Ramphocelus carbo.png
85500;Ramphocelus;carbo;Silver-beaked Tanager;;Nargila Moura;Brazil;Paragominas, PA, Brazil, Bacia 423;-3.4678;-47.4628;song and calls;1 B243 T9 P300 ramphocelus carbo_ Nuargila Moura (pyriglena_ cryp soui_  form cgrise syn guja).mp3;http://www.xeno-canto.org/sounds/uploaded/CWEIBYBYYD/1 B243 T9 P300 ramphocelus carbo_ Nuargila Moura (pyriglena_ cryp soui_  form cgrise syn guja).mp3;http://www.xeno-canto.org/sounds/uploaded/CWEIBYBYYD/ffts/tb/1 B243 T9 P300 ramphocelus carbo_ Nuargila Moura (pyriglena_ cryp soui_  form cgrise syn guja).png
87845;Ramphocelus;carbo;Silver-beaked Tanager;;David Geale;Peru;Pantiacolla Lodge, Madre de Dios;;;Song and call;SBTAf2011sep260527.mp3;http://www.xeno-canto.org/sounds/uploaded/SBFBVYGIJC/SBTAf2011sep260527.mp3;http://www.xeno-canto.org/sounds/uploaded/SBFBVYGIJC/ffts/tb/SBTAf2011sep260527.png
88337;Ramphocelus;carbo;Silver-beaked Tanager;;Alexandre Renaudier;French Guiana;Kourou, barrage de Petit-Saut (usine);5.0501;53.0501;song;20110831RAMCAR.mp3;http://www.xeno-canto.org/sounds/uploaded/GKADEITXTH/20110831RAMCAR.mp3;http://www.xeno-canto.org/sounds/uploaded/GKADEITXTH/ffts/tb/20110831RAMCAR.png
91088;Ramphocelus;carbo;Silver-beaked Tanager;;Oswaldo Cortes;Peru;Cock-of-the-Rock Lodge, San Pedro, Pilcopata Road, Dpto. Cusco  About 0.5km up rd from the lodge;;;songs;ramphocelus carbo manu.mp3;http://www.xeno-canto.org/sounds/uploaded/VVDRVZCVWW/ramphocelus carbo manu.mp3;http://www.xeno-canto.org/sounds/uploaded/VVDRVZCVWW/ffts/tb/ramphocelus carbo manu.png
94285;Ramphocelus;carbo;Silver-beaked Tanager;;Leonardo Ordóñez-Delgado;Ecuador;Bosque Protector Colonso, Tena - Napo;-0.9428;-77.8953;Call;15. Ramphocelus carbo.mp3;http://www.xeno-canto.org/sounds/uploaded/RJNSQXBIJE/15. Ramphocelus carbo.mp3;http://www.xeno-canto.org/sounds/uploaded/RJNSQXBIJE/ffts/tb/15. Ramphocelus carbo.png
95002;Ramphocelus;carbo;Silver-beaked Tanager;;Daniel Lane;Ecuador;Sacha Lodge, Rio Napo, Orellana;-0.4714;-76.4603;song, call;Ramphocelus carbo090705_06.mp3;http://www.xeno-canto.org/sounds/uploaded/WOEAFQRMUD/Ramphocelus carbo090705_06.mp3;http://www.xeno-canto.org/sounds/uploaded/WOEAFQRMUD/ffts/tb/Ramphocelus carbo090705_06.png
95614;Ramphocelus;carbo;Silver-beaked Tanager;;Daniel Lane;Ecuador;Sacha Lodge, Rio Napo, Orellana;-0.4714;-76.4603;song;Ramphocelus carbo100122_01.mp3;http://www.xeno-canto.org/sounds/uploaded/WOEAFQRMUD/Ramphocelus carbo100122_01.mp3;http://www.xeno-canto.org/sounds/uploaded/WOEAFQRMUD/ffts/tb/Ramphocelus carbo100122_01.png
95615;Ramphocelus;carbo;Silver-beaked Tanager;;Daniel Lane;Ecuador;Sacha Lodge, Rio Napo, Orellana;-0.4714;-76.4603;song;Ramphocelus carbo100122_02.mp3;http://www.xeno-canto.org/sounds/uploaded/WOEAFQRMUD/Ramphocelus carbo100122_02.mp3;http://www.xeno-canto.org/sounds/uploaded/WOEAFQRMUD/ffts/tb/Ramphocelus carbo100122_02.png
97575;Ramphocelus;carbo;Silver-beaked Tanager;;Thomas Donegan;Colombia;SPF;0;0;Calls;Disc 17 track 036 Ramphocelus carbo.mp3;http://www.xeno-canto.org/sounds/uploaded/OXSIOLJJUP/Disc 17 track 036 Ramphocelus carbo.mp3;http://www.xeno-canto.org/sounds/uploaded/OXSIOLJJUP/ffts/tb/Disc 17 track 036 Ramphocelus carbo.png
