16202;Sicalis;lutea;Puna Yellow Finch;;Niels Krabbe;Bolivia;Callipampa (Oruro);-18.5001;-67.5001;Calls;095 Puna Yellow-Finch (Sicalis lutea) 1.mp3;http://www.xeno-canto.org/sounds/uploaded/XTVEPHMPPJ/095 Puna Yellow-Finch (Sicalis lutea) 1.mp3;http://www.xeno-canto.org/sounds/uploaded/XTVEPHMPPJ/ffts/tb/095 Puna Yellow-Finch (Sicalis lutea) 1.png
47490;Sicalis;lutea;Puna Yellow Finch;;Niels Krabbe;Bolivia;Callipampa (Oruro);-18.5001;-67.5001;calls from the ground and in flight;Sicalis_lutea,_Callipampa,_Oruro,_1830S_6730,_3680_m,_06_Jan_1984,_NKrabbe,_call_ground_and_flight.mp3;http://www.xeno-canto.org/sounds/uploaded/XTVEPHMPPJ/Sicalis_lutea,_Callipampa,_Oruro,_1830S_6730,_3680_m,_06_Jan_1984,_NKrabbe,_call_ground_and_flight.mp3;http://www.xeno-canto.org/sounds/uploaded/XTVEPHMPPJ/ffts/tb/Sicalis_lutea,_Callipampa,_Oruro,_1830S_6730,_3680_m,_06_Jan_1984,_NKrabbe,_call_ground_and_flight.png
54601;Sicalis;lutea;Puna Yellow Finch;;Carlos Ferrari;Argentina;Sierras de Cochinoca- Jujuy-Argentina;;;Song;Sicalis lutea-macho-SrrasCochinoca-Jujuy-26feb10-CarlosFerrari.mp3;http://www.xeno-canto.org/sounds/uploaded/ZYWOYHEPUK/Sicalis lutea-macho-SrrasCochinoca-Jujuy-26feb10-CarlosFerrari.mp3;http://www.xeno-canto.org/sounds/uploaded/ZYWOYHEPUK/ffts/tb/Sicalis lutea-macho-SrrasCochinoca-Jujuy-26feb10-CarlosFerrari.png
74182;Sicalis;lutea;Puna Yellow Finch;;Joseph Tobias and Nathalie Seddon;Bolivia;Caracollo, La Paz, BO;-17.43888889;-69.306;song;Sicalis_lutea_T665.mp3;http://www.xeno-canto.org/sounds/uploaded/IKMWQIXRNV/Sicalis_lutea_T665.mp3;http://www.xeno-canto.org/sounds/uploaded/IKMWQIXRNV/ffts/tb/Sicalis_lutea_T665.png
74183;Sicalis;lutea;Puna Yellow Finch;;Joseph Tobias and Nathalie Seddon;Bolivia;Caracollo, La Paz, BO;-17.43888889;-69.306;song;Sicalis_lutea_T668.mp3;http://www.xeno-canto.org/sounds/uploaded/IKMWQIXRNV/Sicalis_lutea_T668.mp3;http://www.xeno-canto.org/sounds/uploaded/IKMWQIXRNV/ffts/tb/Sicalis_lutea_T668.png
95540;Sicalis;lutea;Puna Yellow Finch;;Bernabe Lopez-Lanus;Argentina;Yavi, Jujuy;-22.1345;-65.4645;Calls;Sicalis lutea_2_Rio Seco_Yavi_Jujuy_Arg_14FEB2012_Bernabe Lopez-Lanus.mp3;http://www.xeno-canto.org/sounds/uploaded/BYLLSJRVDZ/Sicalis lutea_2_Rio Seco_Yavi_Jujuy_Arg_14FEB2012_Bernabe Lopez-Lanus.mp3;http://www.xeno-canto.org/sounds/uploaded/BYLLSJRVDZ/ffts/tb/Sicalis lutea_2_Rio Seco_Yavi_Jujuy_Arg_14FEB2012_Bernabe Lopez-Lanus.png
