997;Tachyphonus;coronatus;Ruby-crowned Tanager;;Ronald van den Berg;Brazil;?;;;song;Ruby_crowned_Tanager.mp3;http://www.xeno-canto.org/sounds/uploaded/PGBFDFRXVW/Ruby_crowned_Tanager.mp3;http://www.xeno-canto.org/sounds/uploaded/PGBFDFRXVW/ffts/tb/Ruby_crowned_Tanager.png
4643;Tachyphonus;coronatus;Ruby-crowned Tanager;;Bob Planqué;Brazil;Parque do Zizo, Sao Paulo State;-24.017146;-47.81044;song;Rubycrowned_Tanager_song_Zizo-1-66.mp3;http://www.xeno-canto.org/sounds/uploaded/OH38YHKJBS/Rubycrowned_Tanager_song_Zizo-1-66.mp3;http://www.xeno-canto.org/sounds/uploaded/OH38YHKJBS/ffts/tb/Rubycrowned_Tanager_song_Zizo-1-66.png
5527;Tachyphonus;coronatus;Ruby-crowned Tanager;;Bob Planqué;Brazil;Parque do Zizo, Sao Paulo State;-24.017146;-47.81044;dawn song;Rubycrowned_Tanager_song_zizo-5-50.mp3;http://www.xeno-canto.org/sounds/uploaded/OH38YHKJBS/Rubycrowned_Tanager_song_zizo-5-50.mp3;http://www.xeno-canto.org/sounds/uploaded/OH38YHKJBS/ffts/tb/Rubycrowned_Tanager_song_zizo-5-50.png
7714;Tachyphonus;coronatus;Ruby-crowned Tanager;;Fernando Jacobs;Brazil;09001 Coqueiro - São Lourenço do Sul, Rio Grande do Sul;-31.3653;-51.9784;calls;Tie-preto - Tachyphonus coronatus01.mp3;http://www.xeno-canto.org/sounds/uploaded/MHHPJBCUXC/Tie-preto - Tachyphonus coronatus01.mp3;http://www.xeno-canto.org/sounds/uploaded/MHHPJBCUXC/ffts/tb/Tie-preto - Tachyphonus coronatus01.png
7715;Tachyphonus;coronatus;Ruby-crowned Tanager;;Fernando Jacobs;Brazil;09001 Coqueiro - São Lourenço do Sul, Rio Grande do Sul;-31.3653;-51.9784;song;Tie-preto - Tachyphonus coronatus02.mp3;http://www.xeno-canto.org/sounds/uploaded/MHHPJBCUXC/Tie-preto - Tachyphonus coronatus02.mp3;http://www.xeno-canto.org/sounds/uploaded/MHHPJBCUXC/ffts/tb/Tie-preto - Tachyphonus coronatus02.png
69567;Tachyphonus;coronatus;Ruby-crowned Tanager;;Frank Lambert;Brazil;Sao Paulo. Fazenda Capricornia, near Ubatuba;-23.4;-45.1;song;Tachyphonus_rufus_1997a-FRL_BR_12_753-796_1_C.mp3;http://www.xeno-canto.org/sounds/uploaded/YTUXOCTUEM/Tachyphonus_rufus_1997a-FRL_BR_12_753-796_1_C.mp3;http://www.xeno-canto.org/sounds/uploaded/YTUXOCTUEM/ffts/tb/Tachyphonus_rufus_1997a-FRL_BR_12_753-796_1_C.png
11763;Tachyphonus;coronatus;Ruby-crowned Tanager;;Ricardo Gagliardi;Brazil;Fazenda Floresta - Teresópolis - RJ;-22.3598;-42.9167;song;Tachyphonus_coronatus_TRSPRJ_150107.mp3;http://www.xeno-canto.org/sounds/uploaded/YRDADNREOP/Tachyphonus_coronatus_TRSPRJ_150107.mp3;http://www.xeno-canto.org/sounds/uploaded/YRDADNREOP/ffts/tb/Tachyphonus_coronatus_TRSPRJ_150107.png
11829;Tachyphonus;coronatus;Ruby-crowned Tanager;;Charles Hesse;Brazil;n of Garuva, Sta Catarina;-25.9517;-48.8139;Call;brga099RCTAN191206.mp3;http://www.xeno-canto.org/sounds/uploaded/FMQSRXIRTH/brga099RCTAN191206.mp3;http://www.xeno-canto.org/sounds/uploaded/FMQSRXIRTH/ffts/tb/brga099RCTAN191206.png
13262;Tachyphonus;coronatus;Ruby-crowned Tanager;;Ricardo Gagliardi;Brazil;Taquaril - Petrópolis - RJ;-22.3023;-43.077;call;Tachyphonus_coronatus_Mimus_saturninus_PP_210407.mp3;http://www.xeno-canto.org/sounds/uploaded/YRDADNREOP/Tachyphonus_coronatus_Mimus_saturninus_PP_210407.mp3;http://www.xeno-canto.org/sounds/uploaded/YRDADNREOP/ffts/tb/Tachyphonus_coronatus_Mimus_saturninus_PP_210407.png
13702;Tachyphonus;coronatus;Ruby-crowned Tanager;;Leonardo Pimentel;Brazil;Reserva Ecológica de Guapiaçu, RJ;-22.5001;-42.7167;Call;Tachyphonus coronatus.mp3;http://www.xeno-canto.org/sounds/uploaded/JHBOHGJALL/Tachyphonus coronatus.mp3;http://www.xeno-canto.org/sounds/uploaded/JHBOHGJALL/ffts/tb/Tachyphonus coronatus.png
14329;Tachyphonus;coronatus;Ruby-crowned Tanager;;Paul Smith;Paraguay;PROCOSARA, PN San Rafael;-26.48333;-55.71667;chip and short song;Tachyphonuscoronatuschip.mp3;http://www.xeno-canto.org/sounds/uploaded/QEQQOPLWSO/Tachyphonuscoronatuschip.mp3;http://www.xeno-canto.org/sounds/uploaded/QEQQOPLWSO/ffts/tb/Tachyphonuscoronatuschip.png
17223;Tachyphonus;coronatus;Ruby-crowned Tanager;;Nuno Medeiros;Brazil;Paiva Lake, Mariana MG;-20.3231;-43.3959;Song;923_NEW.mp3;http://www.xeno-canto.org/sounds/uploaded/WTQPQQHZBV/923_NEW.mp3;http://www.xeno-canto.org/sounds/uploaded/WTQPQQHZBV/ffts/tb/923_NEW.png
24001;Tachyphonus;coronatus;Ruby-crowned Tanager;;www.aapimentao.com.br;Brazil;Serra Laurentino - Laurentino - Santa Catarina;-27.2273;-49.7206;Canto;Canon 815.mp3;http://www.xeno-canto.org/sounds/uploaded/VVQBELMRMH/Canon 815.mp3;http://www.xeno-canto.org/sounds/uploaded/VVQBELMRMH/ffts/tb/Canon 815.png
24122;Tachyphonus;coronatus;Ruby-crowned Tanager;;www.aapimentao.com.br;Brazil;Serra Caçador - Laurentino - Santa Catarina;-27.2195;-49.7181;canto;Canon 849.mp3;http://www.xeno-canto.org/sounds/uploaded/VVQBELMRMH/Canon 849.mp3;http://www.xeno-canto.org/sounds/uploaded/VVQBELMRMH/ffts/tb/Canon 849.png
25805;Tachyphonus;coronatus;Ruby-crowned Tanager;;Tim Hirsch;Brazil;Sítio do Cervo, Miracatú-SP;-24.38333;-47.7;Breeding song;Ruby-crowned tanager breeding song.mp3;http://www.xeno-canto.org/sounds/uploaded/BMVCNRFNOY/Ruby-crowned tanager breeding song.mp3;http://www.xeno-canto.org/sounds/uploaded/BMVCNRFNOY/ffts/tb/Ruby-crowned tanager breeding song.png
26474;Tachyphonus;coronatus;Ruby-crowned Tanager;;Eduardo Patrial;Brazil;Estância Patrial, Londrina, PR;;;song;Tachyphonus_coronatus_(Ruby-crowned_Tanager)e.p.25.11.08.mp3;http://www.xeno-canto.org/sounds/uploaded/QEFRRVCRRP/Tachyphonus_coronatus_(Ruby-crowned_Tanager)e.p.25.11.08.mp3;http://www.xeno-canto.org/sounds/uploaded/QEFRRVCRRP/ffts/tb/Tachyphonus_coronatus_(Ruby-crowned_Tanager)e.p.25.11.08.png
29036;Tachyphonus;coronatus;Ruby-crowned Tanager;;Fernando Jacobs;Brazil;Dunas, área de proteção ambiental, Las Acácias - Pelotas, Rio Grande do Sul;-31.75;-52.28333;song;700603_Tie-preto_-_Tachyphonus_coronatus.mp3;http://www.xeno-canto.org/sounds/uploaded/MHHPJBCUXC/700603_Tie-preto_-_Tachyphonus_coronatus.mp3;http://www.xeno-canto.org/sounds/uploaded/MHHPJBCUXC/ffts/tb/700603_Tie-preto_-_Tachyphonus_coronatus.png
42014;Tachyphonus;coronatus;Ruby-crowned Tanager;;Adrian Eisen Rupp;Brazil;Fortaleza (Campus V FURB), Blumenau, Santa Catarina;-26.8562;-49.0506;song;Tachyphonus_coronatus_Campos V FURB_Blumenau_25-10-2009.mp3;http://www.xeno-canto.org/sounds/uploaded/AOPMSCIDIA/Tachyphonus_coronatus_Campos V FURB_Blumenau_25-10-2009.mp3;http://www.xeno-canto.org/sounds/uploaded/AOPMSCIDIA/ffts/tb/Tachyphonus_coronatus_Campos V FURB_Blumenau_25-10-2009.png
42082;Tachyphonus;coronatus;Ruby-crowned Tanager;;Adrian Eisen Rupp;Brazil;Vale do Selke Pequeno, Pomerode, Santa Catarina;-26.7673;-49.1464;call;Tachyphonus coronatus_Vale do Selke Pequeno_Pomerode_SC_06-09-2009.mp3;http://www.xeno-canto.org/sounds/uploaded/AOPMSCIDIA/Tachyphonus coronatus_Vale do Selke Pequeno_Pomerode_SC_06-09-2009.mp3;http://www.xeno-canto.org/sounds/uploaded/AOPMSCIDIA/ffts/tb/Tachyphonus coronatus_Vale do Selke Pequeno_Pomerode_SC_06-09-2009.png
42143;Tachyphonus;coronatus;Ruby-crowned Tanager;;Adrian Eisen Rupp;Brazil;Rio Carreiro, Serafina Corrêa, Rio Grande do Sul;-28.9612;-51.7681;call;Tachyphonus coronatus_Rio Carreiro_Serafina Correa_RS_16-09-2009.mp3;http://www.xeno-canto.org/sounds/uploaded/AOPMSCIDIA/Tachyphonus coronatus_Rio Carreiro_Serafina Correa_RS_16-09-2009.mp3;http://www.xeno-canto.org/sounds/uploaded/AOPMSCIDIA/ffts/tb/Tachyphonus coronatus_Rio Carreiro_Serafina Correa_RS_16-09-2009.png
43272;Tachyphonus;coronatus;Ruby-crowned Tanager;;Evair Legal;Brazil;RPPN Prima Luna, Nova Trento, Santa Catarina;-27.258;-49.02;song;Thraupidae._Tachyphonus_coronatus_RPPN_Prima_Luna_20.01.2010_ELXC.mp3;http://www.xeno-canto.org/sounds/uploaded/SMJXFKLATM/Thraupidae._Tachyphonus_coronatus_RPPN_Prima_Luna_20.01.2010_ELXC.mp3;http://www.xeno-canto.org/sounds/uploaded/SMJXFKLATM/ffts/tb/Thraupidae._Tachyphonus_coronatus_RPPN_Prima_Luna_20.01.2010_ELXC.png
47049;Tachyphonus;coronatus;Ruby-crowned Tanager;;Bernabe Lopez-Lanus;Argentina;Yacutinga Lodge, Andresito, Misiones;-25.716791;-54.414597;Call;Tachyphonus coronatus_Ruby-crowned Tanager_Yacutinga Lodge_Andresito_Misiones_Argentina_18MAR03_Bernabe Lopez-Lanus.mp3;http://www.xeno-canto.org/sounds/uploaded/BYLLSJRVDZ/Tachyphonus coronatus_Ruby-crowned Tanager_Yacutinga Lodge_Andresito_Misiones_Argentina_18MAR03_Bernabe Lopez-Lanus.mp3;http://www.xeno-canto.org/sounds/uploaded/BYLLSJRVDZ/ffts/tb/Tachyphonus coronatus_Ruby-crowned Tanager_Yacutinga Lodge_Andresito_Misiones_Argentina_18MAR03_Bernabe Lopez-Lanus.png
52112;Tachyphonus;coronatus;Ruby-crowned Tanager;;Bernabe Lopez-Lanus;Argentina;Reserva Yacutinga, Misiones;;;song;TANAGER Ruby-crowned_03_Reserva Yacutinga_Misiones_AR_19MAR03_Bernabe Lopez-Lanus  SN.mp3;http://www.xeno-canto.org/sounds/uploaded/BYLLSJRVDZ/TANAGER Ruby-crowned_03_Reserva Yacutinga_Misiones_AR_19MAR03_Bernabe Lopez-Lanus  SN.mp3;http://www.xeno-canto.org/sounds/uploaded/BYLLSJRVDZ/ffts/tb/TANAGER Ruby-crowned_03_Reserva Yacutinga_Misiones_AR_19MAR03_Bernabe Lopez-Lanus  SN.png
58341;Tachyphonus;coronatus;Ruby-crowned Tanager;;Bernabe Lopez-Lanus;Brazil;Parque Nacional Itatiaia (Hotel Simon), Rio de Janeiro;;;Female call;Tachyphonus coronatus H_Hotel Simon_PN Itatiaia_Rio de Janeiro_Brasil_23FEB2004 am a_Bernabe Lopez-Lanus.mp3;http://www.xeno-canto.org/sounds/uploaded/BYLLSJRVDZ/Tachyphonus coronatus H_Hotel Simon_PN Itatiaia_Rio de Janeiro_Brasil_23FEB2004 am a_Bernabe Lopez-Lanus.mp3;http://www.xeno-canto.org/sounds/uploaded/BYLLSJRVDZ/ffts/tb/Tachyphonus coronatus H_Hotel Simon_PN Itatiaia_Rio de Janeiro_Brasil_23FEB2004 am a_Bernabe Lopez-Lanus.png
60917;Tachyphonus;coronatus;Ruby-crowned Tanager;;Miguel Castelino;Argentina;Alrededores de Candelaria, Misiones;;;song;TANAGER Ruby-crowned_01_Alrededores de Candelaria_Misiones_AR_17NOV99_Miguel Castelino.mp3;http://www.xeno-canto.org/sounds/uploaded/RCJCABZSNP/TANAGER Ruby-crowned_01_Alrededores de Candelaria_Misiones_AR_17NOV99_Miguel Castelino.mp3;http://www.xeno-canto.org/sounds/uploaded/RCJCABZSNP/ffts/tb/TANAGER Ruby-crowned_01_Alrededores de Candelaria_Misiones_AR_17NOV99_Miguel Castelino.png
60918;Tachyphonus;coronatus;Ruby-crowned Tanager;;Miguel Castelino;Argentina;Iguazu, Misiones;;;song;TANAGER Ruby-crowned_02_Iguazu_Misiones_AR_NOV89_Miguel Castelino.mp3;http://www.xeno-canto.org/sounds/uploaded/RCJCABZSNP/TANAGER Ruby-crowned_02_Iguazu_Misiones_AR_NOV89_Miguel Castelino.mp3;http://www.xeno-canto.org/sounds/uploaded/RCJCABZSNP/ffts/tb/TANAGER Ruby-crowned_02_Iguazu_Misiones_AR_NOV89_Miguel Castelino.png
61768;Tachyphonus;coronatus;Ruby-crowned Tanager;;Sofia Wasylyk;Argentina;Reserva Yacutinga Lodge, Misiones;;;song;TANAGER Ruby-crowned_04_Reserva Yacutinga Lodge_Misiones_AR_Sofia Wasylyk.mp3;http://www.xeno-canto.org/sounds/uploaded/LJJBXKZHHB/TANAGER Ruby-crowned_04_Reserva Yacutinga Lodge_Misiones_AR_Sofia Wasylyk.mp3;http://www.xeno-canto.org/sounds/uploaded/LJJBXKZHHB/ffts/tb/TANAGER Ruby-crowned_04_Reserva Yacutinga Lodge_Misiones_AR_Sofia Wasylyk.png
75538;Tachyphonus;coronatus;Ruby-crowned Tanager;;Daniel Lane;Brazil;Parque Estadual Intervales, SP;-24.2759;-48.4181;song;Tachyphonus coronatus110213_T514.mp3;http://www.xeno-canto.org/sounds/uploaded/WOEAFQRMUD/Tachyphonus coronatus110213_T514.mp3;http://www.xeno-canto.org/sounds/uploaded/WOEAFQRMUD/ffts/tb/Tachyphonus coronatus110213_T514.png
75551;Tachyphonus;coronatus;Ruby-crowned Tanager;;Daniel Lane;Brazil;Parque Estadual Intervales, SP;-24.2759;-48.4181;call;Tachyphonus coronatus110215_T528.mp3;http://www.xeno-canto.org/sounds/uploaded/WOEAFQRMUD/Tachyphonus coronatus110215_T528.mp3;http://www.xeno-canto.org/sounds/uploaded/WOEAFQRMUD/ffts/tb/Tachyphonus coronatus110215_T528.png
84749;Tachyphonus;coronatus;Ruby-crowned Tanager;;Jeremy Minns;Brazil;Ubatuba, SP. Corcovado.;-23.5001;-45.2167;Song;TACCOR03.mp3;http://www.xeno-canto.org/sounds/uploaded/DGVLLRYDXS/TACCOR03.mp3;http://www.xeno-canto.org/sounds/uploaded/DGVLLRYDXS/ffts/tb/TACCOR03.png
84750;Tachyphonus;coronatus;Ruby-crowned Tanager;;Jeremy Minns;Brazil;Ubatuba, SP. Praia Vermelha do Sul.;-23.5167;-45.1667;Calls;TACCOR04.mp3;http://www.xeno-canto.org/sounds/uploaded/DGVLLRYDXS/TACCOR04.mp3;http://www.xeno-canto.org/sounds/uploaded/DGVLLRYDXS/ffts/tb/TACCOR04.png
84751;Tachyphonus;coronatus;Ruby-crowned Tanager;;Jeremy Minns;Brazil;Casca d'Anta, Parque Nacional da Serra da Canastra, SW Minas Gerais;-20.2503;-46.3667;Song;TACCOR14.mp3;http://www.xeno-canto.org/sounds/uploaded/DGVLLRYDXS/TACCOR14.mp3;http://www.xeno-canto.org/sounds/uploaded/DGVLLRYDXS/ffts/tb/TACCOR14.png
84752;Tachyphonus;coronatus;Ruby-crowned Tanager;;Jeremy Minns;Brazil;Estrada da Graciosa, Paraná state;-25.3334;-48.9001;Calls;TACCOR15.mp3;http://www.xeno-canto.org/sounds/uploaded/DGVLLRYDXS/TACCOR15.mp3;http://www.xeno-canto.org/sounds/uploaded/DGVLLRYDXS/ffts/tb/TACCOR15.png
84753;Tachyphonus;coronatus;Ruby-crowned Tanager;;Jeremy Minns;Brazil;Parque do Zizo, Sao Paulo state;-24.017146;-47.81044;Song;TACCOR22.mp3;http://www.xeno-canto.org/sounds/uploaded/DGVLLRYDXS/TACCOR22.mp3;http://www.xeno-canto.org/sounds/uploaded/DGVLLRYDXS/ffts/tb/TACCOR22.png
84756;Tachyphonus;coronatus;Ruby-crowned Tanager;;Jeremy Minns;Brazil;Casca d'Anta, Parque Nacional da Serra da Canastra, SW Minas Gerais;-20.2503;-46.3667;Calls;TACRUF01.mp3;http://www.xeno-canto.org/sounds/uploaded/DGVLLRYDXS/TACRUF01.mp3;http://www.xeno-canto.org/sounds/uploaded/DGVLLRYDXS/ffts/tb/TACRUF01.png
