3025;Conirostrum;tamarugense;Tamarugo Conebill;;A. Bennett Hennessey;Chile;Tile;-18.667;-70.267;Songs, calls
3026;Conirostrum;tamarugense;Tamarugo Conebill;;A. Bennett Hennessey;Chile;Tile;-18.667;-70.267;Song
26216;Conirostrum;tamarugense;Tamarugo Conebill;;Sam Woods;Chile;Chaca Valley, Arica and Parinacota Region XV;;;Song
47369;Conirostrum;tamarugense;Tamarugo Conebill;;Niels Krabbe;Peru;21 km E Arequipa, Juliaca road;-16.3876;-71.3367;calls from group of 10
53866;Conirostrum;tamarugense;Tamarugo Conebill;;Guillermo Egli;Chile;Salar de Atacama, II Region;;;song
59897;Conirostrum;tamarugense;Tamarugo Conebill;;Alvaro Jaramillo;Chile;Valle de Chaca, XV Region;-18.7831;-70.2062;song
59898;Conirostrum;tamarugense;Tamarugo Conebill;;Alvaro Jaramillo;Chile;Valle de Chaca, XV Region;-18.7831;-70.2062;song
59899;Conirostrum;tamarugense;Tamarugo Conebill;;Alvaro Jaramillo;Chile;Valle de Chaca, XV Region;-18.7831;-70.2062;song
90450;Conirostrum;tamarugense;Tamarugo Conebill;;Andrew Spencer;Chile;Chaca Valley, XV Region;-18.808;-70.153;song
