1164;Emberizoides;herbicola;Wedge-tailed Grass Finch;;Don Jones;Brazil;gallery forest near Serra do Cipo, Minas Gerais;-19.7714;-43.6551;song
2242;Emberizoides;herbicola;Wedge-tailed Grass Finch;;Sjoerd Mayer;Bolivia;Palmasola, Santa Cruz, Santa Cruz;-17.85;-63.183;Song
3281;Emberizoides;herbicola;Wedge-tailed Grass Finch;;A. Bennett Hennessey;Bolivia;Flor d'Oro, Noel Kempff Mercado NP, Santa Cruz;-13.5501;-61.01;Song
4022;Emberizoides;herbicola;Wedge-tailed Grass Finch;;Luiz Fernando Figueiredo;Brazil;Estacao Experimental de Itapetininga, Sao Paulo State;;;song
7442;Emberizoides;herbicola;Wedge-tailed Grass Finch;;Glauco Alves Pereira;Brazil;Mata da Millenium, Mataraca, State of Paraíba;-6.5834;-35.0501;Song
8150;Emberizoides;herbicola;Wedge-tailed Grass Finch;;Fernando Jacobs;Brazil;near Arroio Santa Bárbara - Pelotas, Rio Grande do Sul;-31.6998;-52.3817;song
9116;Emberizoides;herbicola;Wedge-tailed Grass Finch;;Allen T. Chartier;Venezuela;Bolivar, Pioneer Soldier Monument (Km. 140);5.8334;-61.4667;Song
11408;Emberizoides;herbicola;Wedge-tailed Grass Finch;;Robson Silva e Silva;Brazil;Catalão, Goiás State;-18.16583;-47.94639;
13709;Emberizoides;herbicola;Wedge-tailed Grass Finch;;Leonardo Pimentel;Brazil;Reserva Ecológica de Guapiaçu, RJ;-22.5001;-42.7167;Song
15366;Emberizoides;herbicola;Wedge-tailed Grass Finch;;Juan Mazar Barnett;Paraguay;Aguará Ñu, Canindeyú;-24.1167;-55.4334;Song
16789;Emberizoides;herbicola;Wedge-tailed Grass Finch;;Paulo C. Almeida;Brazil;Taboao - Itabirito MG;-21.98667;-44.03389;Song
21301;Emberizoides;herbicola;Wedge-tailed Grass Finch;;Ricardo Gagliardi;Brazil;Posse dos Coqueiros - Areal - RJ;-22.2501;-43.2501;call
22409;Emberizoides;herbicola;Wedge-tailed Grass Finch;sphenurus;Andrew Spencer;Venezuela;Rio Kukenan camp on the way to Cerro Roraima, Bolivar;5.1323;-60.8001;song
22410;Emberizoides;herbicola;Wedge-tailed Grass Finch;sphenurus;Andrew Spencer;Venezuela;Rio Kukenan camp on the way to Cerro Roraima, Bolivar;5.1323;-60.8001;song
22411;Emberizoides;herbicola;Wedge-tailed Grass Finch;sphenurus;Andrew Spencer;Venezuela;Rio Kukenan camp on the way to Cerro Roraima, Bolivar;5.1323;-60.8001;call
22412;Emberizoides;herbicola;Wedge-tailed Grass Finch;sphenurus;Andrew Spencer;Venezuela;Rio Kukenan camp on the way to Cerro Roraima, Bolivar;5.1323;-60.8001;call
23456;Emberizoides;herbicola;Wedge-tailed Grass Finch;;Paul Donahue;Brazil;Hyacinth Valley camp, Piaui;-9.45;-45.07;song
23771;Emberizoides;herbicola;Wedge-tailed Grass Finch;;Paul Donahue;Bolivia;Heath River Wildlife Center, Rio Heath, La Paz;-12.68422;-68.718452;call
23773;Emberizoides;herbicola;Wedge-tailed Grass Finch;;Paul Donahue;Bolivia;Heath River Wildlife Center, Rio Heath, La Paz;-12.68422;-68.718452;song
23974;Emberizoides;herbicola;Wedge-tailed Grass Finch;;Guilherme Serpa;Brazil;Águia Branca-ES;;;song
24384;Emberizoides;herbicola;Wedge-tailed Grass Finch;;Nunes D'Acosta;Brazil;Corrego Cristal, Cristalina, Goias;;;song
30502;Emberizoides;herbicola;Wedge-tailed Grass Finch;;Jon Hornbuckle;Bolivia;About 1.5 km north of El Porvenir. El Porvenir, Beni Biological Station (Beni).;-14.8334;-66.2501;Calls.
33400;Emberizoides;herbicola;Wedge-tailed Grass Finch;;Marcos Melo;Brazil;Carrancas, Minas Gerais;-21.4706;-44.6376;song
42045;Emberizoides;herbicola;Wedge-tailed Grass Finch;;Marcos Melo;Brazil;Itu, São Paulo;-23.270681;-47.298889;song
49452;Emberizoides;herbicola;Wedge-tailed Grass Finch;;Rosendo Fraga;Bolivia;Estacion Biologica del Beni,  Beni;;;song
49453;Emberizoides;herbicola;Wedge-tailed Grass Finch;;Rosendo Fraga;Argentina;Estero Mberity, Corrientes;;;song
49454;Emberizoides;herbicola;Wedge-tailed Grass Finch;;Rosendo Fraga;Argentina;Estero Mberity, Corrientes;;;song
49455;Emberizoides;herbicola;Wedge-tailed Grass Finch;;Rosendo Fraga;Paraguay;Estero de Estancia San Jose, Itapua;;;song
49456;Emberizoides;herbicola;Wedge-tailed Grass Finch;;Rosendo Fraga;Paraguay;Estero de Estancia San Jose, Itapua;;;song
49457;Emberizoides;herbicola;Wedge-tailed Grass Finch;;Rosendo Fraga;Bolivia;Estacion BiolOgica del Beni, Beni;;;song
54076;Emberizoides;herbicola;Wedge-tailed Grass Finch;;Fabricio Gorleri;Argentina;Los Picazos, Tres Marias, Formosa;;;song
59346;Emberizoides;herbicola;Wedge-tailed Grass Finch;sphenurus;Renaudier Alexandre;French Guiana;Tonate-Macouria, Pripris Maillard;5.001;-52.463;song
60482;Emberizoides;herbicola;Wedge-tailed Grass Finch;;Miguel Castelino;Argentina;Teyucuare, Misiones;;;song
60483;Emberizoides;herbicola;Wedge-tailed Grass Finch;;Miguel Castelino;Argentina;Rincon Santa Maria, Corrientes;;;song
60484;Emberizoides;herbicola;Wedge-tailed Grass Finch;;Miguel Castelino;Argentina;Puerto Gonzalez, Corrientes;;;song
60485;Emberizoides;herbicola;Wedge-tailed Grass Finch;;Miguel Castelino;Argentina;Puerto Gonzalez, Corrientes;;;song
60486;Emberizoides;herbicola;Wedge-tailed Grass Finch;;Miguel Castelino;Argentina;Rincon de Santa Maria, Corrientes;;;song
61240;Emberizoides;herbicola;Wedge-tailed Grass Finch;;Bernabe Lopez-Lanus;Argentina;Campo Avalos, Rio Mirinay-cerca Casco Cambai, Monte Caseros, Corrientes;;;Song
61241;Emberizoides;herbicola;Wedge-tailed Grass Finch;;Bernabe Lopez-Lanus;Argentina;Campo Avalos, Rio Mirinay-cerca Casco Cambai, Monte Caseros, Corrientes;;;Alarm call
61689;Emberizoides;herbicola;Wedge-tailed Grass Finch;;Sofia Wasylyk;Argentina;Reserva El Bagual, Formosa;;;song
61690;Emberizoides;herbicola;Wedge-tailed Grass Finch;;Sofia Wasylyk;Argentina;Reserva El Bagual, Formosa;;;song
98805;Emberizoides;herbicola;Wedge-tailed Grass Finch;sphenurus;Andrew Spencer;Ecuador;Pucapamba, Zamora-Chinchipe;-4.937;-79.106;flight song
63418;Emberizoides;herbicola;Wedge-tailed Grass Finch;;Joseph Tobias and Nathalie Seddon;Bolivia;Noel Kempff Mercado National Park, Flor de Oro;;;song
66130;Emberizoides;herbicola;Wedge-tailed Grass Finch;;Roger Ahlman;Ecuador;La Chonta, Zamora-Chinchipe;-4.94;-79.098;Song
98806;Emberizoides;herbicola;Wedge-tailed Grass Finch;sphenurus;Andrew Spencer;Ecuador;Pucapamba, Zamora-Chinchipe;-4.937;-79.106;song
73547;Emberizoides;herbicola;Wedge-tailed Grass Finch;;Joseph Tobias and Nathalie Seddon;Bolivia;San Lorenzo de Pampa, Beni, BO;-11.03936111;-65.74944444;song
73548;Emberizoides;herbicola;Wedge-tailed Grass Finch;;Joseph Tobias and Nathalie Seddon;Bolivia;San Lorenzo de Pampa, Beni, BO;-11.03936111;-65.74944444;song
82784;Emberizoides;herbicola;Wedge-tailed Grass Finch;;David Geale;Peru;Pampa Juliaca, Pampas del Heath, Madre de Dios;-12.9556;-68.8845;Song
82992;Emberizoides;herbicola;Wedge-tailed Grass Finch;;Ottavio Janni;Peru;Quebrada Mishquiyacu, Moyobamba, San Martin;-6.0792;-76.9762;call
84494;Emberizoides;herbicola;Wedge-tailed Grass Finch;herbicola;Jeremy Minns;Brazil;Guiné, Bahia;-12.7667;-41.5334;Call
84495;Emberizoides;herbicola;Wedge-tailed Grass Finch;herbicola;Jeremy Minns;Brazil;Parque Nacional Serra da Canastra, São Roque de Minas, MG;-20.24528;-46.36583;Song and calls
84496;Emberizoides;herbicola;Wedge-tailed Grass Finch;herbicola;Jeremy Minns;Brazil;Itirapina;-22.2501;-47.9001;Call
84497;Emberizoides;herbicola;Wedge-tailed Grass Finch;herbicola;Jeremy Minns;Brazil;Vila Bela da Santíssima Trindade;-14.9834;-59.9834;Song
90204;Emberizoides;herbicola;Wedge-tailed Grass Finch;herbicola;Alexander Lees;Brazil;Abade, GO;-15.85;-48.888;calls
