10732;Heterospingus;xanthopygius;Scarlet-browed Tanager;xanthopygius?;Nick Athanas;Colombia;RNA El Paujil, Serrania de las Quinchas,Santander, Colombia;5.9334;-74.1834;song
19522;Heterospingus;xanthopygius;Scarlet-browed Tanager;;Scott Olmstead;Ecuador;Tundaloma Lodge, Esmeraldas;1.182277;-78.756094;call
30926;Heterospingus;xanthopygius;Scarlet-browed Tanager;;Andrew Spencer;Ecuador;Trail to the Rio Mira 4 km. west of Alto Tambo, Esmeraldas;0.9562;-78.5484;calls
36995;Heterospingus;xanthopygius;Scarlet-browed Tanager;berliozi;Charlie Vogt;Ecuador;Rio Silanche, Pedro Vicente Maldonado, Pichincha;0.1431;-79.1334;call
62110;Heterospingus;xanthopygius;Scarlet-browed Tanager;berliozi;Andrew Spencer;Ecuador;Rio Silanche, Pedro Vicente Maldonado, Pichincha;0.1431;-79.1334;song
62210;Heterospingus;xanthopygius;Scarlet-browed Tanager;berliozi;Andrew Spencer;Ecuador;Humedal del Yalare, Esmeraldas;1.1001;-78.8501;call
71239;Heterospingus;xanthopygius;Scarlet-browed Tanager;;Daniel Lane;Ecuador;20km NNE Pedro Vicente Maldonado, Imbabura;0.2501;-79.07;call, song
