17959;Melozone;aberti;Abert's Towhee;;Andrew Spencer;United States;Catalina State Park, Pima Co., Arizona;32.43619;-110.90482;squeel duet
17801;Melozone;aberti;Abert's Towhee;;Nathan Pieplow;United States;Boyce Thompson Arboretum, Superior, Arizona;33.27879;-111.154776;call
17802;Melozone;aberti;Abert's Towhee;;Nathan Pieplow;United States;Henderson Bird Viewing Preserve, Henderson, Nevada;36.0753;-115.0101;call
17803;Melozone;aberti;Abert's Towhee;;Nathan Pieplow;United States;Boyce Thompson Arboretum, Superior, Arizona;33.27879;-111.154776;'seet' call
17804;Melozone;aberti;Abert's Towhee;;Nathan Pieplow;United States;Cibola National Wildlife Refuge, Cibola, Arizona;33.3117;-114.68912;'seet' call
51313;Melozone;aberti;Abert's Towhee;aberti;Mike Nelson;United States;Sunset Park, Las Vegas;36.063;-115.113;Flight Song
66351;Melozone;aberti;Abert's Towhee;;Scott Olmstead;United States;Tubac Bridge, Santa Cruz Co., AZ;31.612;-111.041;'seet' call
79661;Melozone;aberti;Abert's Towhee;;Scott Olmstead;United States;Empire Gulch, Pima Co., AZ;31.7889;-110.6448;song
79805;Melozone;aberti;Abert's Towhee;dumeticolus;Ryan P. O'Donnell;United States;Tonaquint Park, St. George, Washington County, Utah;37.08;-113.6;Call
