3182;Phaeothlypis;fulvicauda;Buff-rumped Warbler;;A. Bennett Hennessey;Bolivia;Serranía Sadiri, Madidi NP, La Paz;-14.167;-67.917;Song
6952;Phaeothlypis;fulvicauda;Buff-rumped Warbler;;Ken Allaire;Panama;El Valle de Anton, Cocle;8.6001;-80.1251;song
9519;Phaeothlypis;fulvicauda;Buff-rumped Warbler;;Alexander Lees;Brazil;Serra dos Caiabis, Alta Floresta - MT;-10.7501;-56.7501;song
11146;Phaeothlypis;fulvicauda;Buff-rumped Warbler;;Martin Cody;Nicaragua;Bartola;10.99849;-84.452591;song
11962;Phaeothlypis;fulvicauda;Buff-rumped Warbler;semicervinus;Nick Athanas;Ecuador;Kumanii Lodge, Esmeraldas;0.7539;-78.9209;song
12751;Phaeothlypis;fulvicauda;Buff-rumped Warbler;;Oscar Laverde;Colombia;Otanche, Boyacá, Otanche, La Ye, Serranía de las Quinchas;5.8167;-74.3001;song
12752;Phaeothlypis;fulvicauda;Buff-rumped Warbler;;Oscar Laverde;Colombia;Otanche, Boyacá, Otanche, La Ye, Serranía de las Quinchas;5.8167;-74.3001;song
13423;Phaeothlypis;fulvicauda;Buff-rumped Warbler;;Roger Ahlman;Peru;Amazon Manu Lodge;-12.3398;-70.7339;song
15527;Phaeothlypis;fulvicauda;Buff-rumped Warbler;;Don Jones;Costa Rica;Estación Biológica Las Cruces, San Vito de Coto Brus, Puntarenas;8.7834;-82.9501;song
17541;Phaeothlypis;fulvicauda;Buff-rumped Warbler;semicervinus;Andrew Spencer;Ecuador;Trail to the Rio Mira 4 km. west of Alto Tambo, Esmeraldas;0.9562;-78.5484;song
18133;Phaeothlypis;fulvicauda;Buff-rumped Warbler;;Herman van Oosten;Colombia;El canon del Rio Claro, Antioquia;5.8334;-74.8667;Song
35146;Phaeothlypis;fulvicauda;Buff-rumped Warbler;semicervina;Nick Athanas;Ecuador;Milpe, Pichincha;0.0287;-78.8628;song
35394;Phaeothlypis;fulvicauda;Buff-rumped Warbler;significans?;David Geale;Peru;Pantiacolla Lodge, Manu, Madre de Dios;-12.6601;-71.242;Call
36241;Phaeothlypis;fulvicauda;Buff-rumped Warbler;;Frank Lambert;Peru;Manu Road nr San Pedro;-13.0242;-71.4728;song
39796;Phaeothlypis;fulvicauda;Buff-rumped Warbler;fulvicauda;David Geale;Peru;Amazon Manu Lodge, Madre de Dios;-12.335;-70.7262;Song
42374;Phaeothlypis;fulvicauda;Buff-rumped Warbler;;Oswaldo Cortes;Colombia;Vereda Cumaca, Municipio de Tibacuy, Cundinamarca;4.3331;-74.4764;songs
43453;Phaeothlypis;fulvicauda;Buff-rumped Warbler;;Oswaldo Cortes;Colombia;Pnn Tatama, Municipio de Pueblo Rico;5.227;-76.035;song
54230;Phaeothlypis;fulvicauda;Buff-rumped Warbler;;Bernabe Lopez-Lanus;Colombia;Finca La Magnolia, Corregimiento Totumo, Ibague, Tolima;;;Song 1
54231;Phaeothlypis;fulvicauda;Buff-rumped Warbler;;Bernabe Lopez-Lanus;Colombia;Finca La Magnolia, Corregimiento Totumo, Ibague, Tolima;;;Song 1
54232;Phaeothlypis;fulvicauda;Buff-rumped Warbler;;Bernabe Lopez-Lanus;Colombia;Finca La Magnolia, Corregimiento Totumo, Ibague, Tolima;;;Song 2
54233;Phaeothlypis;fulvicauda;Buff-rumped Warbler;;Bernabe Lopez-Lanus;Colombia;Finca La Magnolia, Corregimiento Totumo, Ibague, Tolima;;;Song 2
54234;Phaeothlypis;fulvicauda;Buff-rumped Warbler;;Bernabe Lopez-Lanus;Colombia;Finca La Magnolia, Corregimiento Totumo, Ibague, Tolima;;;Song 2
59604;Phaeothlypis;fulvicauda;Buff-rumped Warbler;leucopygius;Mike Nelson;Panama;Torti, San Francisco Nature Reserve, Panama;8.9389;-78.4651;song
61021;Phaeothlypis;fulvicauda;Buff-rumped Warbler;;David Geale;Peru;Amazon Manu Lodge, Madre de Dios;-12.335;-70.7262;Song
63180;Phaeothlypis;fulvicauda;Buff-rumped Warbler;;Joseph Tobias and Nathalie Seddon;Peru;Cocha Cashu Biological Station, Manu National Park;-11.8667;-71.3667;song
63181;Phaeothlypis;fulvicauda;Buff-rumped Warbler;;Joseph Tobias and Nathalie Seddon;Peru;Cocha Cashu Biological Station, Manu National Park;-11.8667;-71.3667;call
63182;Phaeothlypis;fulvicauda;Buff-rumped Warbler;;Joseph Tobias and Nathalie Seddon;Peru;Cocha Cashu Biological Station, Manu National Park;-11.8667;-71.3667;song
63183;Phaeothlypis;fulvicauda;Buff-rumped Warbler;;Joseph Tobias and Nathalie Seddon;Peru;Cocha Cashu Biological Station, Manu National Park;-11.8667;-71.3667;song
66648;Phaeothlypis;fulvicauda;Buff-rumped Warbler;;Jeremy Minns;Brazil;Reserva Extrativista Alto Juruá. Foz do Tejo;-8.9826;-72.7148;Calls
71137;Phaeothlypis;fulvicauda;Buff-rumped Warbler;semicervina;Daniel Lane;Ecuador;17km NW Pedro Vicente Maldonado, Pichincha;0.2578;-79.192;call
71216;Phaeothlypis;fulvicauda;Buff-rumped Warbler;semicervina;Daniel Lane;Ecuador;20km NNE Pedro Vicente Maldonado, Imbabura;0.2501;-79.07;song, call
72423;Phaeothlypis;fulvicauda;Buff-rumped Warbler;leucopygia;Andrew Spencer;Costa Rica;La Selva, Sarapiqui, Heredia;10.4314;-84.0389;song
75080;Phaeothlypis;fulvicauda;Buff-rumped Warbler;;Eliana Fierro-Calderón;Colombia;Alto Anchicaya, corregimiento El Danubio, Valle;3.3889;-76.7998;call, song
73217;Phaeothlypis;fulvicauda;Buff-rumped Warbler;;Joseph Tobias and Nathalie Seddon;Bolivia;Los Indios, Pando, BO;-10.53336111;-65.60780556;song
74756;Phaeothlypis;fulvicauda;Buff-rumped Warbler;semicervina;Daniel Lane;Ecuador;2.7km E Alto Tambo, Esmeraldas;0.892;-78.533;song
75081;Phaeothlypis;fulvicauda;Buff-rumped Warbler;;Eliana Fierro-Calderón;Colombia;Alto Anchicaya, corregimiento El Danubio, Valle;3.3889;-76.7998;call, song
76149;Phaeothlypis;fulvicauda;Buff-rumped Warbler;;Ken Allaire;Panama;El Chorogo, Puerto Armuelles, Chiriquí;8.285;-82.9928;call
76265;Phaeothlypis;fulvicauda;Buff-rumped Warbler;;Ian Davies;Ecuador;Reserva Mangaloma, Pichincha;0.1228;-78.9942;Song
76422;Phaeothlypis;fulvicauda;Buff-rumped Warbler;semicervinus;Roger Ahlman;Ecuador;Milpe, Pichincha;0.0287;-78.8628;Call
78843;Phaeothlypis;fulvicauda;Buff-rumped Warbler;;Oswaldo Cortes;Colombia;desierto de la Tatacoa_Huila;;;song
81839;Phaeothlypis;fulvicauda;Buff-rumped Warbler;fulvicauda;Andrew Spencer;Colombia;Mitu, Vaupes;1.2598;-70.2367;song
86301;Phaeothlypis;fulvicauda;Buff-rumped Warbler;fulvicauda;Jeremy Minns;Colombia;Serrania de la Macarena. Caño Cristales;2.213;-73.823;Song
88587;Phaeothlypis;fulvicauda;Buff-rumped Warbler;;David Geale;Peru;Amazon Manu Lodge, Madre de Dios;-12.335;-70.7262;Song
91931;Phaeothlypis;fulvicauda;Buff-rumped Warbler;;Oswaldo Cortes;Colombia;Casa del Sol Naciente, San Agustin, Huila;1.887;-76.2628;songs
92768;Phaeothlypis;fulvicauda;Buff-rumped Warbler;;Tom Stevens;Costa Rica;TCU Research Station;10.2501;-84.5501;Calls
93045;Phaeothlypis;fulvicauda;Buff-rumped Warbler;;Oswaldo Cortes;Colombia;San Francisco, Vereda El Peñon (Cundinarma);5.013;-74.244;songs
93557;Phaeothlypis;fulvicauda;Buff-rumped Warbler;;Tom Stevens;Costa Rica;TCU Research Station;10.2501;-84.5501;Song
