2257;Piranga;hepatica;Hepatic Tanager;;Don Jones;Belize;Hidden Valley Inn (grounds);;;call
21759;Piranga;hepatica;Hepatic Tanager;;Chris Parrish;United States;Cave Creek, Chiricahua Mountains, Cochise County, Arizona;31.8848;-109.1756;Songs
21764;Piranga;hepatica;Hepatic Tanager;;Chris Parrish;United States;Cave Creek, Chiricahua Mountains, Cochise County, Arizona;31.8848;-109.1756;Songs
34137;Piranga;hepatica;Hepatic Tanager;dextra;Andrew Spencer;United States;Guadalupe Mountains National Park, Culberson Co., Texas;31.912536;-104.878922;song
34138;Piranga;hepatica;Hepatic Tanager;dextra;Andrew Spencer;United States;Guadalupe Mountains National Park, Culberson Co., Texas;31.912536;-104.878922;call
34566;Piranga;hepatica;Hepatic Tanager;hepatica;Andrew Spencer;United States;Cave Creek, Cochise Co., Arizona;31.8848;-109.1756;calls
34567;Piranga;hepatica;Hepatic Tanager;hepatica;Andrew Spencer;United States;Barfoot Junction, Cochise Co., Arizona;31.9328;-109.2634;calls
34568;Piranga;hepatica;Hepatic Tanager;hepatica;Andrew Spencer;United States;Barfoot Junction, Cochise Co., Arizona;31.9328;-109.2634;calls
35383;Piranga;hepatica;Hepatic Tanager;hepatica;Andrew Spencer;United States;Reef Campground, Carr Canyon, Cochise Co., Arizona;31.427052;-110.297413;song
