5211;Schistochlamys;ruficapillus;Cinnamon Tanager;;Ciro Albano;Brazil;Araripe National Forest, Crato, Ceará State;-7.2501;-39.5834;Song
5401;Schistochlamys;ruficapillus;Cinnamon Tanager;;Richard C. Hoyer;Brazil;Araripe National Forest, Crato, Ceará State;-7.2501;-39.5834;song
13210;Schistochlamys;ruficapillus;Cinnamon Tanager;;Ricardo Gagliardi;Brazil;Taquaril - Petrópolis - RJ;-22.3023;-43.077;call
15591;Schistochlamys;ruficapillus;Cinnamon Tanager;capistrata;Nick Athanas;Brazil;5km south of Palmeiras, BA;-12.5562;-41.5798;call
42776;Schistochlamys;ruficapillus;Cinnamon Tanager;;Marcos Melo;Brazil;APA Capivari Monos, São Paulo, SP;-23.9556;-46.6503;calls
84679;Schistochlamys;ruficapillus;Cinnamon Tanager;ruficapillus;Jeremy Minns;Brazil;Parque Nacional Serra da Canastra, São Roque de Minas, MG;-20.24528;-46.36583;Song
84680;Schistochlamys;ruficapillus;Cinnamon Tanager;ruficapillus;Jeremy Minns;Brazil;Parque Nacional da Serra do Cipó, Minas Gerais State;-19.3481;-43.6189;Song
84681;Schistochlamys;ruficapillus;Cinnamon Tanager;capistratus;Jeremy Minns;Brazil;Morro do Pai Inácio, Chapada Diamantina, Bahia;-12.4576;-41.4734;Call and song
