5981;Tangara;mexicana;Turquoise Tanager;;Sidnei de Melo Dantas;Brazil;Tapajós National Forest;-3.4834;-54.9167;calls
9900;Tangara;mexicana;Turquoise Tanager;;Sidnei de Melo Dantas;Brazil;Belém, state of Pará;-1.4506;-48.4439;calls
13062;Tangara;mexicana;Turquoise Tanager;brasiliensis;Leonardo Pimentel;Brazil;Reserva Ecológica de Guapiaçu, RJ;-22.5001;-42.7167;Call
69570;Tangara;mexicana;Turquoise Tanager;brasiliensis;Frank Lambert;Brazil;Bahia. Fazenda Veracruz Reserve, near Una;-15.2;-39.3;calls
87383;Tangara;mexicana;Turquoise Tanager;;Sidnei S. dos Santos;Brazil;Entre Rios, Bahia.;;;Call
96313;Tangara;mexicana;Turquoise Tanager;;Bradley Davis;Brazil;Bacia 112, Santarém, PA;-2.6759;-54.5028;calls
