9910;Turdus;olivater;Black-hooded Thrush;;Andrew Spencer;Venezuela;Barinas, San Isidro Tunnel Road;8.8501;-70.5667;song
9911;Turdus;olivater;Black-hooded Thrush;;Andrew Spencer;Venezuela;Barinas, San Isidro Tunnel Road;8.8501;-70.5667;call
14041;Turdus;olivater;Black-hooded Thrush;;Bradley Davis;Colombia;RNA El Dorado, Sierra de Santa Marta, Magdalena;11.1078;-74.0487;calls?
65912;Turdus;olivater;Black-hooded Thrush;;Daniel Lane;Venezuela;San Isidro quarry, Barinas;8.8323;-70.5801;call
65913;Turdus;olivater;Black-hooded Thrush;;Daniel Lane;Venezuela;San Isidro quarry, Barinas;8.8323;-70.5801;call
75243;Turdus;olivater;Black-hooded Thrush;sanctaemartae;Fabrice Schmitt;Colombia;RNA El Dorado, Sierra de Santa Marta, Magdalena;11.1078;-74.0487;song
